Symbol,CompanyName,DpmName
APWC,ASIA PACIFIC WIRE & CABLE CORP ORD,
APXT,APEX TECHNOLOGY ACQUISITION CO COM CL A,"Susquehanna Securities, LLC"
APXTU,APEX TECHNOLOGY ACQUISITION CO UNIT EX 061126,
APXTW,APEX TECHNOLOGY ACQUISITION CO WT EXP 091826,
APYX,APYX MEDICAL CORPORATION COM,
AQB,AQUABOUNTY TECHNOLOGIES INC COM NEW,"Wolverine Trading, LLC"
AQMS,AQUA METALS INC COM,"Group One Trading, L.P."
AQN,ALGONQUIN PWR UTILS CORP COM,"Wolverine Trading, LLC"
AQNA,ALGONQUIN PWR UTILS CORP 6.875 SB NT A 78,
AQNB,ALGONQUIN PWR UTILS CORP SUB NT A 19,
AQST,AQUESTIVE THERAPEUTICS INC COM,
AQUA,EVOQUA WATER TECHNOLOGIES CORP COM,
AR,ANTERO RESOURCES CORP COM,"Susquehanna Securities, LLC"
ARAV,ARAVIVE INC COM,"Susquehanna Securities, LLC"
ARAY,ACCURAY INC COM,"Group One Trading, L.P."
ARB,ALTSHARES TRUST MERGER ARBITRAGE,
ARBG,AEQUI ACQUISITION CORP COM CL A,
ARBGU,AEQUI ACQUISITION CORP UNIT EXP 113027,
ARBGW,AEQUI ACQUISITION CORP WT EXP 113027,
ARC,ARC DOCUMENT SOLUTIONS INC COM,"Wolverine Trading, LLC"
ARCB,ARCBEST CORP COM,GTS Securities LLC
ARCC,ARES CAPITAL CORP COM,Citadel Securities LLC
ARCE,ARCO PLATFORM LTD COM CL A,
ARCH,ARCH RESOURCES INC CL A,Citadel Securities LLC
ARCM,ARROW INVTS TR RESV CAP ETF,
ARCO,ARCOS DORADOS HOLDINGS INC SHS CLASS -A -,"Group One Trading, L.P."
ARCT,ARCTURUS THERAPEUTICS HLDGS COM,"Group One Trading, L.P."
ARCW,ARC GROUP WORLDWIDE INC COM,
ARD,ARDAGH GROUP S A CL A,Belvedere Trading LLC
ARDC,ARES DYNAMIC CR ALLOCATION FD COM,
ARDMQ,ARADIGM CORP COM,
ARDS,ARIDIS PHARMACEUTICALS INC COM,
ARDX,ARDELYX INC COM,Citadel Securities LLC
ARE,ALEXANDRIA REAL ESTATE EQ INC COM,"Wolverine Trading, LLC"
AREC,AMERICAN RES CORP CL A,
ARES,ARES MANAGEMENT CORPORATION CL A COM STK,"Susquehanna Securities, LLC"
ARES-A,ARES MANAGEMENT CORPORATION 7% SER A PFD STK,
AREXQ,APPROACH RESOURCES INC COM,
ARGD,ARGO GROUP US INC 6.5% SR NTS 42,
ARGO,ARGO GROUP INTL HLDGS LTD COM,
ARGO-A,ARGO GROUP INTL HLDGS LTD 7% DEP SH PFD A,
ARGT,GLOBAL X FDS GB MSCI AR ETF,"Susquehanna Securities, LLC"
ARGX,ARGENX SE SPONSORED ADR,"Susquehanna Securities, LLC"
ARI,APOLLO COML REAL EST FIN INC COM,Belvedere Trading LLC
ARKF,ARK ETF TR FINTECH INNOVA,"Group One Trading, L.P."
ARKG,ARK ETF TR GENOMIC REV ETF,Belvedere Trading LLC
ARKIU,ARK GLOBAL ACQUISITION CORP UNIT EX 010128,
ARKK,ARK ETF TR INNOVATION ETF,Belvedere Trading LLC
ARKO,ARKO CORP COM,
ARKOW,ARKO CORP WT EXP 122225,
ARKQ,ARK ETF TR AUTNMUS TECHNLGY,"Wolverine Trading, LLC"
ARKR,ARK RESTAURANTS CORP COM,
ARKW,ARK ETF TR NEXT GNRTN INTER,"Wolverine Trading, LLC"
ARL,AMERICAN RLTY INVS INC COM,
ARLO,ARLO TECHNOLOGIES INC COM,"Group One Trading, L.P."
ARLP,ALLIANCE RESOURCE PARTNERS L P UT LTD PART,"Susquehanna Securities, LLC"
ARLZQ,ARALEZ PHARMACEUTICALS INC COM,
ARMK,ARAMARK COM,"Susquehanna Securities, LLC"
ARMP,ARMATA PHARMACEUTICALS INC COM,
ARMR,EXCHANGE LISTED FDS TR ARMOR US EQT IDX,
ARNA,ARENA PHARMACEUTICALS INC COM NEW,Citadel Securities LLC
ARNC,ARCONIC CORPORATION COM,Citadel Securities LLC
AROC,ARCHROCK INC COM,Citadel Securities LLC
AROW,ARROW FINL CORP COM,
ARPO,AERPIO PHARMACEUTICALS INC COM,
ARQT,ARCUTIS BIOTHERAPEUTICS INC COM,Citadel Securities LLC
ARR,ARMOUR RESIDENTIAL REIT INC COM NEW,"Group One Trading, L.P."
ARR-C,ARMOUR RESIDENTIAL REIT INC 7% SER C CUM PFD,
ARRY,ARRAY TECHNOLOGIES INC COM SHS,Citadel Securities LLC
ARTL,ARTELO BIOSCIENCES INC COM NEW,
ARTLW,ARTELO BIOSCIENCES INC WT EXP 062524,
ARTNA,ARTESIAN RES CORP CL A,
ARTW,ARTS WAY MFG INC COM,
ARVN,ARVINAS INC COM,"Susquehanna Securities, LLC"
ARW,ARROW ELECTRS INC COM,Citadel Securities LLC
ARWR,ARROWHEAD PHARMACEUTICALS INC COM,"Wolverine Trading, LLC"
ARYA,ARYA SCIENCES ACQUISITION CORP COM CL A,"Susquehanna Securities, LLC"
ARYD,ARYA SCIENCES ACQU CORP IV CL A,
ASA,ASA GOLD AND PRECIOUS MTLS LMT SHS,"Susquehanna Securities, LLC"
ASAI#,SENDAS DISTRIBUIDORA S A SPON ADS,
ASAN,ASANA INC CL A,"Susquehanna Securities, LLC"
ASAQ,ATLANTIC AVE ACQUISITION CORP COM CL A,
ASAQ+,ATLANTIC AVE ACQUISITION CORP WT EXP 100627,
ASAQ=,ATLANTIC AVE ACQUISITION CORP UNIT,
ASAXU,ASTREA ACQUISITION CORP UNIT 012828,
ASB,ASSOCIATED BANC CORP COM,"Susquehanna Securities, LLC"
ASB-C,ASSOCIATED BANC CORP DEP SHS 1/40 C,
ASB-D,ASSOCIATED BANC CORP DEP PFD NONCUM D,
ASB-E,ASSOCIATED BANC CORP DEP SHS PFD E,
ASB-F,ASSOCIATED BANC CORP 5.625 DP PF SR F,
ASC,ARDMORE SHIPPING CORP COM,"Wolverine Trading, LLC"
ASCMQ,ASCENT CAP GROUP INC COM SER A,
ASEA,GLOBAL X FDS GBL X FTSE ETF,
ASET,FLEXSHARES TR REAL ASST IDX,
ASG,LIBERTY ALL-STAR GROWTH FD INC COM,
ASGI,ABERDEEN STD GLOBAL INFRASTRUC COM SHS BEN INT,
ASGN,ASGN INC COM,"Wolverine Trading, LLC"
ASH,ASHLAND GLOBAL HLDGS INC COM,Citadel Securities LLC
ASHR,DBX ETF TR XTRACK HRVST CSI,"Susquehanna Securities, LLC"
ASHS,DBX ETF TR XTRACK CSI 500 A,Belvedere Trading LLC
ASHX,DBX ETF TR XTRACK MSCI CHIN,
ASIX,ADVANSIX INC COM,Citadel Securities LLC
ASLE,AERSALE CORPORATION COM,
ASLEW,AERSALE CORPORATION WT EXP 110425,
ASLN,ASLAN PHARMACEUTICALS LTD ADS,
ASM,AVINO SILVER & GOLD MINES LTD COM,
ASMB,ASSEMBLY BIOSCIENCES INC COM,"Susquehanna Securities, LLC"
ASML,ASML HOLDING N V N Y REGISTRY SHS,"Susquehanna Securities, LLC"
ASNAQ,ASCENA RETAIL GROUP INC COM NEW,
ASND,ASCENDIS PHARMA A/S SPONSORED ADR,"Susquehanna Securities, LLC"
ASO,ACADEMY SPORTS & OUTDOORS INC COM,Belvedere Trading LLC
ASPCU,ALPHA CAPITAL ACQUISITION CO UNIT EX 021626,
ASPL,ASPIRATIONAL CONSUMER LIFESTYL COM,
ASPL+,ASPIRATIONAL CONSUMER LIFESTYL WT EXP 091925,
ASPL=,ASPIRATIONAL CONSUMER LIFESTYL UNIT,
ASPN,ASPEN AEROGELS INC COM,"Group One Trading, L.P."
ASPS,ALTISOURCE PORTFOLIO SOLNS SA REG SHS,"Wolverine Trading, LLC"
ASPU,ASPEN GROUP INC COM NEW,
ASR,GRUPO AEROPORTUARIO DEL SUREST SPON ADR SER B,"Susquehanna Securities, LLC"
ASRT,ASSERTIO HOLDINGS INC COM STK,Morgan Stanley & Co. LLC
ASRV,AMERISERV FINL INC COM,
ASRVP,AMERISERV FINL CAP TR I PFD A GTD 8.45,
ASTC,ASTROTECH CORP COM NEW,
ASTE,ASTEC INDS INC COM,"Susquehanna Securities, LLC"
ASUR,ASURE SOFTWARE INC COM,"Wolverine Trading, LLC"
ASX,ASE TECHNOLOGY HLDG CO LTD SPONSORED ADS,
ASYS,AMTECH SYS INC COM PAR $0.01N,"Susquehanna Securities, LLC"
ASZ=,AUSTERLITZ ACQUISITION CORP II UNIT,
AT,ATLANTIC POWER CORP COM NEW,Morgan Stanley & Co. LLC
ATA,AMERICAS TECHNOLOGY ACQSN CORP SHS,
ATA+,AMERICAS TECHNOLOGY ACQSN CORP WT EXP 123127,
ATA=,AMERICAS TECHNOLOGY ACQSN CORP UNIT,
ATAC,ALTIMAR ACQUISITION CORP SHS CL A,"Group One Trading, L.P."
ATAC+,ALTIMAR ACQUISITION CORP WT EXP,
ATAC=,ALTIMAR ACQUISITION CORP UNIT,
ATAX,AMERICA FIRST MULTIFAMILY INV BEN UNIT CTF,
ATC,ATOTECH LTD COM,
ATCO,ATLAS CORP SHARES,Morgan Stanley & Co. LLC
ATCO-D,ATLAS CORP 7.95% CUM PFD D,
ATCO-E,ATLAS CORP 8.25% CUM PFD E,
ATCO-G,ATLAS CORP 8.20% CUM PFD G,
ATCO-H,ATLAS CORP 7.875% CUM PFD H,
ATCO-I,ATLAS CORP FIX FLT CM PFD I,
ATCX,ATLAS TECHNICAL CONSULTANTS IN COM CLS A,
ATEC,ALPHATEC HLDGS INC COM NEW,"Group One Trading, L.P."
ATEN,A10 NETWORKS INC COM,Citadel Securities LLC
ATEX,ANTERIX INC COM,Belvedere Trading LLC
ATGE,ADTALEM GLOBAL ED INC COM,"Two Sigma Securities, LLC"
ATH,ATHENE HOLDING LTD CL A,"Susquehanna Securities, LLC"
ATH-A,ATHENE HOLDING LTD DEP RP PFD A,
ATH-B,ATHENE HOLDING LTD 5.625 DP SH PF B,
ATH-C,ATHENE HOLDING LTD 6.375 DP PF C,
ATH-D,ATHENE HOLDING LTD 4.875% DEP PFD D,
ATHA,ATHIRA PHARMA INC COM,
ATHE,ALTERITY THERAPEUTICS LTD SPONSORED ADR,
ATHM,AUTOHOME INC SP ADS RP CL A,"Wolverine Trading, LLC"
ATHX,ATHERSYS INC NEW COM,"Group One Trading, L.P."
ATI,ALLEGHENY TECHNOLOGIES INC COM,Citadel Securities LLC
ATIF,ATIF HOLDINGS LIMITED SHS,
ATIS,ATTIS INDS INC COM NEW,
ATISW,ATTIS INDS INC WT EXP 021022,
ATKR,ATKORE INC COM,"Wolverine Trading, LLC"
ATLC,ATLANTICUS HOLDINGS CORP COM,"Susquehanna Securities, LLC"
ATLO,AMES NATL CORP COM,
ATMP,BARCLAYS BANK PLC IPATH SELCT MLP,
ATMR=,ALTIMAR ACQUISITION CORP II UNIT,
ATNF,180 LIFE SCIENCES CORP COM,Morgan Stanley & Co. LLC
ATNFW,180 LIFE SCIENCES CORP WT EXP 110725,
ATNI,ATN INTL INC COM,GTS Securities LLC
ATNM,ACTINIUM PHARMACEUTICALS INC COM,Belvedere Trading LLC
ATNX,ATHENEX INC COM,Citadel Securities LLC
ATO,ATMOS ENERGY CORP COM,"Wolverine Trading, LLC"
ATOM,ATOMERA INC COM,"Susquehanna Securities, LLC"
ATOS,ATOSSA THERAPEUTICS INC COM,"Susquehanna Securities, LLC"
ATR,APTARGROUP INC COM,GTS Securities LLC
ATRA,ATARA BIOTHERAPEUTICS INC COM,Citadel Securities LLC
ATRC,ATRICURE INC COM,
ATRI,ATRION CORP COM,
ATRO,ASTRONICS CORP COM,"Wolverine Trading, LLC"
ATRS,ANTARES PHARMA INC COM,"Group One Trading, L.P."
ATSG,AIR TRANSPORT SERVICES GRP INC COM,"Group One Trading, L.P."
ATTO,ATENTO S A SHS,
ATUS,ALTICE USA INC CL A,Citadel Securities LLC
ATVI,ACTIVISION BLIZZARD INC COM,"Susquehanna Securities, LLC"
ATXI,AVENUE THERAPEUTICS INC COM NEW,
AU,ANGLOGOLD ASHANTI LIMITED SPONSORED ADR,GTS Securities LLC
AUB,ATLANTIC UN BANKSHARES CORP COM,Citadel Securities LLC
AUBAP,ATLANTIC UN BANKSHARES CORP 6.875% DEP PFD A,
AUBN,AUBURN NATL BANCORP COM,
AUDC,AUDIOCODES LTD ORD,Citadel Securities LLC
AUGZ,LISTED FD TR TRUESHARES STRUC,
AUMN,GOLDEN MINERALS CO COM,
AUOTY,AU OPTRONICS CORP SPONSORED ADS,
AUPH,AURINIA PHARMACEUTICALS INC COM,Citadel Securities LLC
AUS=,AUSTERLITZ ACQUISITION CORP I UNIT,
AUSF,GLOBAL X FDS ADAPTIVE US,
AUTL,AUTOLUS THERAPEUTICS PLC SPON ADS,
AUTO,AUTOWEB INC COM,Citadel Securities LLC
AUUD,AUDDIA INC COM,
AUUDW,AUDDIA INC WT EXP 101725,
AUVI,APPLIED UV INC COM,
AUY,YAMANA GOLD INC COM,Morgan Stanley & Co. LLC
AVA,AVISTA CORP COM,Citadel Securities LLC
AVAL,GRUPO AVAL ACCIONES Y VALORES SPONSORED ADS,
AVAN,AVANTI ACQUISITION CORP SHS CL A,
AVAN+,AVANTI ACQUISITION CORP WT EXP,
AVAN=,AVANTI ACQUISITION CORP UNIT,
AVAV,AEROVIRONMENT INC COM,"Susquehanna Securities, LLC"
AVB,AVALONBAY CMNTYS INC COM,Citadel Securities LLC
AVCO,AVALON GLOBOCARE CORP COM,
AVCT,AMERICAN VRTUAL CLOUD TECH INC COM,"Group One Trading, L.P."
AVCTW,AMERICAN VRTUAL CLOUD TECH INC WT EXP 040725,
AVD,AMERICAN VANGUARD CORP COM,"Wolverine Trading, LLC"
AVDE,AMERICAN CENTY ETF TR INTL EQT ETF,
AVDG,NEW AGE ALPHA TR AVDR US LRGCP ES,
AVDL,AVADEL PHARMACEUTICALS PLC SPONSORED ADR,"Susquehanna Securities, LLC"
AVDR,NEW AGE ALPHA TR AVDR US LRGCP LE,
AVDV,AMERICAN CENTY ETF TR INTL SMCP VLU,
AVEM,AMERICAN CENTY ETF TR AVANTIS EMGMKT,
AVEO,AVEO PHARMACEUTICALS INC COM NEW,"Susquehanna Securities, LLC"
AVGO,BROADCOM INC COM,"Susquehanna Securities, LLC"
AVGOP,BROADCOM INC 8% MCNV PFD SR A,
AVGR,AVINGER INC COM,
AVHOQ,AVIANCA HLDGS SA SPON ADR REP PFD,"Susquehanna Securities, LLC"
AVID,AVID TECHNOLOGY INC COM,Citadel Securities LLC
AVIG,AMERICAN CENTY ETF TR AVANTIS CORE FI,
AVIR,ATEA PHARMACEUTICALS INC COM,Citadel Securities LLC
AVK,ADVENT CONVERTIBLE & INCOME FD COM,
AVLR,AVALARA INC COM,Citadel Securities LLC
AVMU,AMERICAN CENTY ETF TR CORE MUNI FXD IN,
AVNS,AVANOS MED INC COM,"Susquehanna Securities, LLC"
AVNT,AVIENT CORPORATION COM,"Wolverine Trading, LLC"
AVNW,AVIAT NETWORKS INC COM NEW,
AVO,MISSION PRODUCE INC COM,
AVRO,AVROBIO INC COM,
AVSF,AMERICAN CENTY ETF TR AVANTIS SHFXDINC,
AVT,AVNET INC COM,GTS Securities LLC
AVTR,AVANTOR INC COM,"Susquehanna Securities, LLC"
AVTR-A,AVANTOR INC 6.25 PFD CNV SR,
AVUS,AMERICAN CENTY ETF TR US EQT ETF,
AVUV,AMERICAN CENTY ETF TR US SML CP VALU,
AVXL,ANAVEX LIFE SCIENCES CORP COM NEW,Citadel Securities LLC
AVY,AVERY DENNISON CORP COM,"Wolverine Trading, LLC"
AVYA,AVAYA HLDGS CORP COM,"Wolverine Trading, LLC"
AWAY,ETF MANAGERS TR ETFMG TRAVEL TEC,Belvedere Trading LLC
AWF,ALLIANCEBERNSTEIN GLOBAL HIGH COM,
AWH,ASPIRA WOMENS HEALTH INC COM,
AWI,ARMSTRONG WORLD INDS INC NEW COM,GTS Securities LLC
AWK,AMERICAN WTR WKS CO INC NEW COM,"Susquehanna Securities, LLC"
AWP,ABERDEEN GLOBAL PREMIER PPTYS COM SH BEN INT,
AWR,AMER STATES WTR CO COM,"Susquehanna Securities, LLC"
AWRE,AWARE INC MASS COM,"Susquehanna Securities, LLC"
AWSM,COOL HLDGS INC COM,
AWTM,TIDAL ETF TR AWARE ULTRASHR,
AWX,AVALON HLDGS CORP CL A,
AX,AXOS FINANCIAL INC COM,"Wolverine Trading, LLC"
AXAS,ABRAXAS PETE CORP COM NEW,"Wolverine Trading, LLC"
AXDX,ACCELERATE DIAGNOSTICS INC COM,Citadel Securities LLC
AXGN,AXOGEN INC COM,"Group One Trading, L.P."
AXL,AMERICAN AXLE & MFG HLDGS INC COM,"Susquehanna Securities, LLC"
AXLA,AXCELLA HEALTH INC COM,
AXNX,AXONICS MODULATION TECHNOLOGIE COM,"Wolverine Trading, LLC"
AXO,AXOS FINANCIAL INC 6.250% SB NT 26,
AXON,AXON ENTERPRISE INC COM,"Susquehanna Securities, LLC"
AXP,AMERICAN EXPRESS CO COM,"Two Sigma Securities, LLC"
AXR,AMREP CORP NEW COM,
AXS,AXIS CAP HLDGS LTD SHS,Citadel Securities LLC
AXS-E,AXIS CAP HLDGS LTD DEP SHS PFD E,
AXSM,AXSOME THERAPEUTICS INC COM,"Susquehanna Securities, LLC"
AXTA,AXALTA COATING SYS LTD COM,Citadel Securities LLC
AXTI,AXT INC COM,Morgan Stanley & Co. LLC
AXU,ALEXCO RESOURCE CORP COM,"Wolverine Trading, LLC"
AY,ATLANTICA SUSTAINABLE INFR PLC SHS,Morgan Stanley & Co. LLC
AYI,ACUITY BRANDS INC COM,Citadel Securities LLC
AYLA,AYALA PHARMACEUTICALS INC COM,
AYRO,AYRO INC COM,"Susquehanna Securities, LLC"
AYTU,AYTU BIOSCIENCE INC COM,
AYX,ALTERYX INC COM CL A,"Susquehanna Securities, LLC"
AZAA,AIM ETF PRODUCTS TRUST US LRG CP BUF10,
AZAJ,AIM ETF PRODUCTS TRUST US LRG CP BUFR10,
AZAL,AIM ETF PRODUCTS TRUST US LRG CAP BUF10,
AZAO,AIM ETF PRODUCTS TRUST US LRG CP BFR 10,
AZBA,AIM ETF PRODUCTS TRUST US LRG CP BUF20,
AZBJ,AIM ETF PRODUCTS TRUST US LRG CP BUFR20,
AZBL,AIM ETF PRODUCTS TRUST US LRG CP BUF20,
AZBO,AIM ETF PRODUCTS TRUST US LRG CP BUFR20,
AZEK,AZEK CO INC CL A,
AZN,ASTRAZENECA PLC SPONSORED ADR,Citigroup Derivatives Markets Inc.
AZO,AUTOZONE INC COM,"Susquehanna Securities, LLC"
AZPN,ASPEN TECHNOLOGY INC COM,"Susquehanna Securities, LLC"
AZRE,AZURE PWR GLOBAL LTD SHS,
AZRX,AZURRX BIOPHARMA INC COM,
AZUL,AZUL S A SPONSR ADR PFD,"Susquehanna Securities, LLC"
AZYO,AZIYO BIOLOGICS INC COM CL A,
AZZ,AZZ INC COM,GTS Securities LLC
B,BARNES GROUP INC COM,"Wolverine Trading, LLC"
BA,BOEING CO COM,Citadel Securities LLC
BAB,INVESCO EXCH TRADED FD TR II TAXABLE MUN BD,
BABA,ALIBABA GROUP HLDG LTD SPONSORED ADS,"Susquehanna Securities, LLC"
BAC,BK OF AMERICA CORP COM,GTS Securities LLC
BAC-A,BK OF AMERICA CORP DEP SHS PFD EE,
BAC-B,BK OF AMERICA CORP 6 NCUM PFD SR GG,
BAC-E,BK OF AMERICA CORP PFD PER1/1000E,
BAC-K,BK OF AMERICA CORP 5.875 NCM PFD HH,
BAC-L,BK OF AMERICA CORP 7.25%CNV PFD L,
BAC-M,BK OF AMERICA CORP 5.375 DP PFD KK,
BAC-N,BK OF AMERICA CORP 5% NCUM PFD LL,
BAC-O,BK OF AMERICA CORP DP SH NCUM NN,
BAC-P,BK OF AMERICA CORP 4.125% DP PFD PP,
BAF,BLACKROCK MUN INCM INVT QTY TR COM,
BAH,BOOZ ALLEN HAMILTON HLDG CORP CL A,"Wolverine Trading, LLC"
BAK,BRASKEM S A SP ADR PFD A,
BAL,BARCLAYS BANK PLC ETN LKD 48,Citadel Securities LLC
BALTF,BARCLAYS BANK PLC ETN DJUBSCOTTN38,
BALY,BALLYS CORPORATION COM,"Group One Trading, L.P."
BAM,BROOKFIELD ASSET MGMT INC CL A LTD VT SH,GTS Securities LLC
BAMH,BROOKFIELD FIN INC SUB NT 80,
BAMI,BROOKFIELD FIN I UK PLC 4.5 PER SUB NTS,
BANC,BANC OF CALIFORNIA INC COM,"Wolverine Trading, LLC"
BANC-D,BANC OF CALIFORNIA INC DEP SHS SER-D,
BANC-E,BANC OF CALIFORNIA INC DEP SHS REPSTG,
BAND,BANDWIDTH INC COM CL A,"Susquehanna Securities, LLC"
BANF,BANCFIRST CORP COM,
BANFP,BFC CAP TR II PFD TR 7.20%,
BANR,BANNER CORP COM NEW,GTS Securities LLC
BANX,STONECASTLE FINL CORP COM,
BAOS,BAOSHENG MEDIA GROUP HLDNG LTD SHS,
BAP,CREDICORP LTD COM,"Susquehanna Securities, LLC"
BAPR,INNOVATOR ETFS TR S&P 500 BUFFER,
BAR,GRANITESHARES GOLD TR SHS BEN INT,
BASI,BIOANALYTICAL SYS INC COM,
BASX,BASIC ENERGY SVCS INC NEW COM NEW,
BATL,BATTALION OIL CORP COM,
BATRA,LIBERTY MEDIA CORP DEL COM A BRAVES GRP,
BATRK,LIBERTY MEDIA CORP DEL COM C BRAVES GRP,
BATT,AMPLIFY ETF TR AMPLIFY LITHIUM,
BAUG,INNOVATOR ETFS TR S&P 500 BUFFER,
BAX,BAXTER INTL INC COM,Citadel Securities LLC
BB,BLACKBERRY LTD COM,"Susquehanna Securities, LLC"
BBAR,BANCO BBVA ARGENTINA S A SPONSORED ADS,"Group One Trading, L.P."
BBAX,J P MORGAN EXCHANGE-TRADED FD BETABULDR DEVE,
BBBY,BED BATH & BEYOND INC COM,GTS Securities LLC
BBC,ETFIS SER TR I VIRTUS LIFESC CT,
BBCA,J P MORGAN EXCHANGE-TRADED FD BETABULDRS CDA,Citadel Securities LLC
BBCP,CONCRETE PUMPING HLDGS INC COM,
BBCPW,CONCRETE PUMPING HLDGS INC WT EXP 080124,
BBD,BANCO BRADESCO S A SP ADR PFD NEW,GTS Securities LLC
BBDC,BARINGS BDC INC COM,Citadel Securities LLC
BBDO,BANCO BRADESCO S A SPONSORED ADR,
BBEU,J P MORGAN EXCHANGE-TRADED FD BETBULD EUROPE,Citadel Securities LLC
BBF,BLACKROCK MUN INCOME INVT TR SHS BEN INT,
BBGI,BEASLEY BROADCAST GROUP INC CL A,
BBH,VANECK VECTORS ETF TR BIOTECH ETF,"Susquehanna Securities, LLC"
BBI,BRICKELL BIOTECH INC COM,
BBIG,VINCO VENTURES INC COM,"Susquehanna Securities, LLC"
BBIN,J P MORGAN EXCHANGE-TRADED FD BETABUILDERS I,
BBIO,BRIDGEBIO PHARMA INC COM,Citadel Securities LLC
BBJP,J P MORGAN EXCHANGE-TRADED FD BETBULD JAPAN,
BBK,BLACKROCK MUN BD TR COM,
BBL,BHP GROUP PLC SPONSORED ADR,"Susquehanna Securities, LLC"
BBMC,J P MORGAN EXCHANGE-TRADED FD BETABUILDERS US,
BBN,BLACKROCK TAX MUNICPAL BD TR SHS,
BBP,ETFIS SER TR I VIRTUS LIFESC BT,
BBQ,BBQ HLDGS INC COM,
BBRE,J P MORGAN EXCHANGE-TRADED FD BETBULD MSCI,
BBSA,J P MORGAN EXCHANGE-TRADED FD BETABLDRS 1-5YR,
BBSC,J P MORGAN EXCHANGE-TRADED FD BETABUILDERS US,
BBSI,BARRETT BUSINESS SVCS INC COM,"Wolverine Trading, LLC"
BBU,BROOKFIELD BUSINESS PARTNERS L UNIT LTD L P,"Wolverine Trading, LLC"
BBUS,J P MORGAN EXCHANGE-TRADED FD BETABUILDRS US,
BBVA,BANCO BILBAO VIZCAYA ARGENTARI SPONSORED ADR,"Group One Trading, L.P."
BBW,BUILD-A-BEAR WORKSHOP INC COM,Citadel Securities LLC
BBY,BEST BUY INC COM,"Susquehanna Securities, LLC"
BC,BRUNSWICK CORP COM,"Susquehanna Securities, LLC"
BC-A,BRUNSWICK CORP 6.5% SR NOTES 48,
BC-B,BRUNSWICK CORP 6.625% SR NT49,
BC-C,BRUNSWICK CORP 6.375 SR NT 49,
BCAB,BIOATLA INC COM,
BCAC,BROOKLINE CAP ACQUISITION CORP COM,
BCACU,BROOKLINE CAP ACQUISITION CORP UNIT EXP 083127,
BCACW,BROOKLINE CAP ACQUISITION CORP WT EXP 083127,
BCAT,BLACKROCK CAP ALLOCATION TR COM,
BCBP,BCB BANCORP INC COM,
BCC,BOISE CASCADE CO DEL COM,"Susquehanna Securities, LLC"
BCD,ETFS TR BBRG ALL LNGR K1,
BCDA,BIOCARDIA INC COM,Citadel Securities LLC
BCDAW,BIOCARDIA INC WT EXP 080624,
BCE,BCE INC COM NEW,Citadel Securities LLC
BCEI,BONANZA CREEK ENERGY INC COM NEW,"Group One Trading, L.P."
BCEL,ATRECA INC CL A COM,
BCH,BANCO DE CHILE SPONSORED ADS,
BCI,ETFS TR BBRG ALL COMD K1,Belvedere Trading LLC
BCLI,BRAINSTORM CELL THERAPEUTICS I COM NEW,"Group One Trading, L.P."
BCM,BARCLAYS BANK PLC IPTH PURE BRD,
BCML,BAYCOM CORP COM,
BCO,BRINKS CO COM,"Susquehanna Securities, LLC"
BCOR,BLUCORA INC COM,Citadel Securities LLC
BCOV,BRIGHTCOVE INC COM,"Susquehanna Securities, LLC"
BCOW,1895 BANCORP OF WIS INC COM,
BCPC,BALCHEM CORP COM,"Susquehanna Securities, LLC"
BCRX,BIOCRYST PHARMACEUTICALS INC COM,"Group One Trading, L.P."
BCS,BARCLAYS PLC ADR,"Susquehanna Securities, LLC"
BCSF,BAIN CAP SPECIALTY FIN INC COM STK,
BCTG,BCTG ACQUISITION CORP COM,
BCTX,BRIACELL THERAPEUTICS CORP COM NEW,
BCTXW,BRIACELL THERAPEUTICS CORP WT EX 022425,
BCV,BANCROFT FD LTD COM,
BCV-A,BANCROFT FD LTD PFD CUM SER A,
BCX,BLACKROCK RES & COMMODITIES ST SHS,
BCYC,BICYCLE THERAPEUTICS PLC SPONSORED ADS,
BCYP,BIG CYPRESS ACQUISITION CORP COM,
BCYPU,BIG CYPRESS ACQUISITION CORP UNIT EX 072527,
BCYPW,BIG CYPRESS ACQUISITION CORP WT EXP 072527,
BDC,BELDEN INC COM,"Wolverine Trading, LLC"
BDCX,UBS AG LONDON BRANCH ETRACS LKD ETN,
BDCZ,UBS AG LONDON BRANCH ETRACS WF BUS DE,
BDDXF,DEUTSCHE BK AG LONDON BRH DB BASE MET DBL,
BDEC,INNOVATOR ETFS TR S&P 500 BUFFER E,
BDJ,BLACKROCK ENHANCED EQUITY DIVI COM,
BDL,FLANIGANS ENTERPRISES INC COM,
BDN,BRANDYWINE RLTY TR SH BEN INT NEW,"Wolverine Trading, LLC"
BDR,BLONDER TONGUE LABS INC COM,
BDRY,ETF MANAGERS GRP COMMDTY TR I BREAKWAVE DRY,
BDSI,BIODELIVERY SCIENCES INTL INC COM,"Wolverine Trading, LLC"
BDSX,BIODESIX INC COM,
BDTX,BLACK DIAMOND THERAPEUTICS INC COM,
BDX,BECTON DICKINSON & CO COM,"Susquehanna Securities, LLC"
BDXB,BECTON DICKINSON & CO 6% DP CONV PFD B,
BE,BLOOM ENERGY CORP COM CL A,"Group One Trading, L.P."
BEAM,BEAM THERAPEUTICS INC COM,Citadel Securities LLC
BECN,BEACON ROOFING SUPPLY INC COM,Citadel Securities LLC
BEDU,BRIGHT SCHOLAR ED HLDGS LTD SPONSORED ADS,
BEEM,BEAM GLOBAL COM,"Wolverine Trading, LLC"
BEEMW,BEAM GLOBAL WT EXP 041524,
BEKE,KE HLDGS INC SPONSORED ADS,Citadel Securities LLC
BELFA,BEL FUSE INC CL A,
BELFB,BEL FUSE INC CL B,
BEN,FRANKLIN RESOURCES INC COM,GTS Securities LLC
BENE,BENESSERE CAPITAL ACQUSTN CORP COM CL A,
BENER,BENESSERE CAPITAL ACQUSTN CORP RT,
BENEU,BENESSERE CAPITAL ACQUSTN CORP UNIT EXP,
BENEW,BENESSERE CAPITAL ACQUSTN CORP WT EX,
BEP,BROOKFIELD RENEWABLE PARTNERS PARTNERSHIP UNIT,"Wolverine Trading, LLC"
BEP-A,BROOKFIELD RENEWABLE PARTNERS 5.25% PFD CL A,
BEPC,BROOKFIELD RENEWABLE CORP CL A SUB VTG,Belvedere Trading LLC
BERY,BERRY GLOBAL GROUP INC COM,"Susquehanna Securities, LLC"
BEST,BEST INC SPONSORED ADS,Citadel Securities LLC
BETZ,LISTED FD TR ROUNDHILL SPORTS,Citadel Securities LLC
BF.A,BROWN FORMAN CORP CL A,
BF.B,BROWN FORMAN CORP CL B,"Wolverine Trading, LLC"
BFAM,BRIGHT HORIZONS FAM SOL IN DEL COM,"Wolverine Trading, LLC"
BFC,BANK FIRST CORP COM,
BFEB,INNOVATOR ETFS TR S&P 500 BUFFER,
BFI,BURGERFI INTERNATIONAL INC COM,"Group One Trading, L.P."
BFIIW,BURGERFI INTERNATIONAL INC WT EXP 121625,
BFIN,BANKFINANCIAL CORP COM,
BFIT,GLOBAL X FDS HELTH WELL ETF,
BFK,BLACKROCK MUN INCOME TR SH BEN INT,
BFLY,BUTTERFLY NETWORK INC COM CL A,"Susquehanna Securities, LLC"
BFLY+,BUTTERFLY NETWORK INC WT EXP 052725,
BFOR,ALPS ETF TR BARRONS 400 ETF,"Susquehanna Securities, LLC"
BFRA,BIOFRONTERA AG SPONSORED ADS,
BFS,SAUL CTRS INC COM,
BFS-D,SAUL CTRS INC 6.125% PFD CUM D,
BFS-E,SAUL CTRS INC 6% DP SH PFD E,
BFST,BUSINESS FIRST BANCSHARES INC COM,
BFT,FOLEY TRASIMENE ACQUISITION COM CL A,Belvedere Trading LLC
BFT+,FOLEY TRASIMENE ACQUISITION WT EXP 081125,
BFT=,FOLEY TRASIMENE ACQUISITION UNIT,
BFTR,BLACKROCK ETF TRUST FUTURE INVTR ETF,
BFY,BLACKROCK NEW YORK MUN INCOME COM,
BFZ,BLACKROCK CALIF MUN INCOME TR SH BEN INT,
BG,BUNGE LIMITED COM,Citigroup Derivatives Markets Inc.
BGB,BLACKSTONE STRATEGIC CREDIT FD COM SHS BEN IN,
BGCP,BGC PARTNERS INC CL A,"Wolverine Trading, LLC"
BGFV,BIG 5 SPORTING GOODS CORP COM,"Wolverine Trading, LLC"
BGH,BARINGS GLOBAL SHORT DURATION COM,
BGI,BIRKS GROUP INC CL A COM,
BGIO,BLACKROCK 2022 GBL INCM OPP TR COM,
BGLD,FIRST TR EXCHANGE-TRADED FD CBOE VEST GLD ST,
BGNE,BEIGENE LTD SPONSORED ADR,Citadel Securities LLC
BGR,BLACKROCK ENERGY & RES TR COM,
BGRN,ISHARES TR GBL GREEN ETF,
BGS,B & G FOODS INC NEW COM,"Wolverine Trading, LLC"
BGSF,BGSF INC COM,
BGT,BLACKROCK FLOATING RATE INCOME COM,
BGX,BLACKSTONE LONG-SHORT CREDIT COM SHS BN INT,
BGY,BLACKROCK ENHANCED INTL DIV TR COM BENE INTER,
BH,BIGLARI HLDGS INC COM STK CL B,
BH.A,BIGLARI HLDGS INC COM STK CL A,
BHAT,BLUE HAT INTERACTIVE ENTMT TEC SHS,
BHB,BAR HBR BANKSHARES COM,
BHC,BAUSCH HEALTH COS INC COM,"Susquehanna Securities, LLC"
BHE,BENCHMARK ELECTRS INC COM,"Susquehanna Securities, LLC"
BHF,BRIGHTHOUSE FINL INC COM,"Susquehanna Securities, LLC"
BHFAL,BRIGHTHOUSE FINL INC 6.25 NT 58,
BHFAN,BRIGHTHOUSE FINL INC 5.375 DEP PFD C,
BHFAO,BRIGHTHOUSE FINL INC 6.75 DP SHS PF B,
BHFAP,BRIGHTHOUSE FINL INC 6.6% DP PFD A,
BHK,BLACKROCK CORE BD TR SHS BEN INT,
BHLB,BERKSHIRE HILLS BANCORP INC COM,
BHP,BHP GROUP LTD SPONSORED ADS,"Susquehanna Securities, LLC"
BHR,BRAEMAR HOTELS & RESORTS INC COM,Citadel Securities LLC
BHR-B,BRAEMAR HOTELS & RESORTS INC 5.5 CUM CV PFD B,
BHR-D,BRAEMAR HOTELS & RESORTS INC 8.25 PFD SER D,
BHSE,BULL HORN HLDGS CORP SHS,
BHSEU,BULL HORN HLDGS CORP UNIT EXP 101325,
BHSEW,BULL HORN HLDGS CORP WT EXP 103125,
BHTG,BIOHITECH GLOBAL INC COM,
BHV,BLACKROCK VA MUNICIPAL BOND TR COM,
BHVN,BIOHAVEN PHARMACTL HLDG CO LTD COM,"Group One Trading, L.P."
BIB,PROSHARES TR PSHS ULT NASB,"Susquehanna Securities, LLC"
BIBL,NORTHERN LTS FD TR IV INSPIRE 100ETF,
BICK,FIRST TR BICK INDEX FD COM SHS,
BIDU,BAIDU INC SPON ADR REP A,Citigroup Derivatives Markets Inc.
BIF,BOULDER GROWTH & INCOME FD INC COM,
BIG,BIG LOTS INC COM,GTS Securities LLC
BIGC,BIGCOMMERCE HLDGS INC COM SER 1,"Susquehanna Securities, LLC"
BIIB,BIOGEN INC COM,"Susquehanna Securities, LLC"
BIL,SPDR SER TR SPDR BLOOMBERG,"Wolverine Trading, LLC"
BILI,BILIBILI INC SPONS ADS REP Z,Citadel Securities LLC
BILL,BILL COM HLDGS INC COM,"Wolverine Trading, LLC"
BILS,SPDR SER TR BBG BARCLAY 3-12,
BIMI,BOQI INTL MED INC COM,
BIO,BIO RAD LABS INC CL A,"Susquehanna Securities, LLC"
BIO.B,BIO RAD LABS INC CL B,
BIOAQ,BIOAMBER INC COM,
BIOC,BIOCEPT INC COM,"Susquehanna Securities, LLC"
BIOL,BIOLASE INC COM NEW,
BIOTU,BIOTECH ACQUISITION COMPANY UNIT EX 113027,
BIOX,BIOCERES CROP SOLUTIONS CORP SHS,
BIP,BROOKFIELD INFRAST PARTNERS LP LP INT UNIT,"Wolverine Trading, LLC"
BIP-A,BROOKFIELD INFRAST PARTNERS LP 5.125 CL A PFD13,
BIP-B,BROOKFIELD INFRAST PARTNERS LP 5.00% PFD A 14,
BIPC,BROOKFIELD INFRASTRUCTURE CORP COM SB VTG SHS A,
BIS,PROSHARES TR ULTST NASD NW20,"Susquehanna Securities, LLC"
BIT,BLACKROCK MULTI-SECTOR INC TR COM,
BITE=,BITE ACQUISITION CORP UNIT,
BIV,VANGUARD BD INDEX FDS INTERMED TERM,"Susquehanna Securities, LLC"
BIVI,BIOVIE INC CL A NEW,
BIZD,VANECK VECTORS ETF TR BDC INCOME ETF,
BJ,BJS WHSL CLUB HLDGS INC COM,Citadel Securities LLC
BJAN,INNOVATOR ETFS TR S&P 500 BUFFER,
BJK,VANECK VECTORS ETF TR GAMING ETF,"Susquehanna Securities, LLC"
BJRI,BJS RESTAURANTS INC COM,"Susquehanna Securities, LLC"
BJUL,INNOVATOR ETFS TR S&P 500 BUFFER,
BJUN,INNOVATOR ETFS TR S&P 500 BUFFER,
BK,BANK NEW YORK MELLON CORP COM,"Two Sigma Securities, LLC"
BKAG,BNY MELLON ETF TRUST CORE BOND ETF,
BKCC,BLACKROCK CAP INVT CORP COM,"Wolverine Trading, LLC"
BKD,BROOKDALE SR LIVING INC COM,"Wolverine Trading, LLC"
BKE,BUCKLE INC COM,"Wolverine Trading, LLC"
BKEM,BNY MELLON ETF TRUST EMRG MKT EQUIT,
BKEP,BLUEKNIGHT ENERGY PARTNERS L P COM UNIT,Belvedere Trading LLC
BKEPP,BLUEKNIGHT ENERGY PARTNERS L P PFD UNIT SER A,
BKF,ISHARES INC MSCI BRIC INDX,"Wolverine Trading, LLC"
BKH,BLACK HILLS CORP COM,
BKHY,BNY MELLON ETF TRUST HIGH YIELD BETA,
BKI,BLACK KNIGHT INC COM,
BKIE,BNY MELLON ETF TRUST INTERNATIONL EQT,
