Symbol,CompanyName,DpmName
ONEQ,FIDELITY COMWLTH TR NDQ CP IDX TRK,
ONEV,SPDR SER TR RUSSELL LOW VOL,
ONEW,ONEWATER MARINE INC CL A COM,
ONEY,SPDR SER TR RUSSELL YIELD,
ONLN,PROSHARES TR ONLINE RTL ETF,Belvedere Trading LLC
ONTO,ONTO INNOVATION INC COM,GTS Securities LLC
ONTX,ONCONOVA THERAPEUTICS INC COM PAR,
ONTXW,ONCONOVA THERAPEUTICS INC WT EXP 071121,
ONVO,ORGANOVO HLDGS INC COM NEW,Belvedere Trading LLC
OOMA,OOMA INC COM,"Wolverine Trading, LLC"
OPBK,OP BANCORP COM,
OPCH,OPTION CARE HEALTH INC COM NEW,
OPEN,OPENDOOR TECHNOLOGIES INC COM,"Group One Trading, L.P."
OPENW,OPENDOOR TECHNOLOGIES INC WT EXP 121825,
OPER,ETF SER SOLUTIONS CLEARSHS ULTRA,
OPGN,OPGEN INC COM,
OPHC,OPTIMUMBANK HLDGS INC COM,
OPI,OFFICE PPTYS INCOME TR COM SHS BEN INT,Belvedere Trading LLC
OPINI,OFFICE PPTYS INCOME TR 5.875% SR NT 46,
OPINL,OFFICE PPTYS INCOME TR 6.375% NT 50,
OPK,OPKO HEALTH INC COM,"Group One Trading, L.P."
OPNT,OPIANT PHARMACEUTICALS INC COM,
OPOF,OLD POINT FINL CORP COM,
OPP,RIVERNORTH DOUBLELINE STRATE COM,
OPP-A,RIVERNORTH DOUBLELINE STRATE 4.375 SER A PFD,
OPRA,OPERA LTD SPONSORED ADS,"Group One Trading, L.P."
OPRT,OPORTUN FINL CORP COM,
OPRX,OPTIMIZERX CORP COM NEW,"Wolverine Trading, LLC"
OPT,OPTHEA LTD SPONSORED ADS,
OPTN,OPTINOSE INC COM,
OPTT,OCEAN PWR TECHNOLOGIES INC COM NEW,
OPY,OPPENHEIMER HLDGS INC CL A NON VTG,"Susquehanna Securities, LLC"
OR,OSISKO GOLD ROYALTIES LTD COM,"Group One Trading, L.P."
ORA,ORMAT TECHNOLOGIES INC COM,"Susquehanna Securities, LLC"
ORAN,ORANGE SPONSORED ADR,"Group One Trading, L.P."
ORBC,ORBCOMM INC COM,Belvedere Trading LLC
ORC,ORCHID IS CAP INC COM,"Wolverine Trading, LLC"
ORCC,OWL ROCK CAPITAL CORPORATION COM,Citadel Securities LLC
ORCL,ORACLE CORP COM,Citadel Securities LLC
OREXQ,OREXIGEN THERAPEUTICS INC COM NEW,
ORGO,ORGANOGENESIS HLDGS INC COM,
ORGOW,ORGANOGENESIS HLDGS INC WT EXP 121023,
ORGS,ORGENESIS INC COM NEW,
ORI,OLD REP INTL CORP COM,"Wolverine Trading, LLC"
ORIC,ORIC PHARMACEUTICALS INC COM,
ORLA,ORLA MNG LTD NEW COM,
ORLY,OREILLY AUTOMOTIVE INC COM,"Wolverine Trading, LLC"
ORMP,ORAMED PHARMACEUTICALS INC COM NEW,"Group One Trading, L.P."
ORN,ORION GROUP HOLDINGS INC COM,Belvedere Trading LLC
ORPH,ORPHAZYME A S ADS,
ORRF,ORRSTOWN FINL SVCS INC COM,
ORTX,ORCHARD THERAPEUTICS PLC ADS,
OSB,NORBORD INC COM NEW,
OSBC,OLD SECOND BANCORP INC ILL COM,
OSCV,ETF SER SOLUTIONS OPUS SML CP VL,
OSG,OVERSEAS SHIPHOLDING GROUP INC CL A NEW,"Group One Trading, L.P."
OSH,OAK STR HEALTH INC COM,Citadel Securities LLC
OSIS,OSI SYSTEMS INC COM,Citadel Securities LLC
OSK,OSHKOSH CORP COM,Morgan Stanley & Co. LLC
OSMT,OSMOTICA PHARMACEUTICALS PLC SHS,
OSN,OSSEN INNOVATION CO LTD SPONSORED ADR NE,
OSPN,ONESPAN INC COM,GTS Securities LLC
OSS,ONE STOP SYS INC COM,
OSTK,OVERSTOCK COM INC DEL COM,Citadel Securities LLC
OSUR,ORASURE TECHNOLOGIES INC COM,Citadel Securities LLC
OSW,ONESPAWORLD HOLDINGS LIMITED COM,"Wolverine Trading, LLC"
OTEL,OTELCO INC CL A NEW,
OTEX,OPEN TEXT CORP COM,"Susquehanna Securities, LLC"
OTIC,OTONOMY INC COM,Citadel Securities LLC
OTIS,OTIS WORLDWIDE CORP COM,Citadel Securities LLC
OTIVF,ON TRACK INNOVATION LTD SHS,
OTLK,OUTLOOK THERAPEUTICS INC COM NEW,
OTLKW,OUTLOOK THERAPEUTICS INC WT EXP A 021822,
OTRA,OTR ACQUISITION CORP COM CL A,
OTRAU,OTR ACQUISITION CORP UNIT EX 100125,
OTRAW,OTR ACQUISITION CORP WT EXP 113027,
OTRK,ONTRAK INC COM,Belvedere Trading LLC
OTRKP,ONTRAK INC 9.5% SER A PFD,
OTTR,OTTER TAIL CORP COM,"Group One Trading, L.P."
OTTW,OTTAWA BANCORP INC COM,
OUNZ,VANECK MERK GOLD TR GOLD TRUST,Belvedere Trading LLC
OUSA,OSI ETF TR OSHARES US QUALT,Belvedere Trading LLC
OUSM,OSI ETF TR OSHARES US SMLCP,
OUT,OUTFRONT MEDIA INC COM,Morgan Stanley & Co. LLC
OVB,LISTED FD TR SHARES CORE BD,
OVBC,OHIO VY BANC CORP COM,
OVF,LISTED FD TR SHARES FOREIGN,
OVID,OVID THERAPEUTICS INC COM,
OVL,LISTED FD TR SHARES LAG CAP,
OVLY,OAK VY BANCORP OAKDALE CALIF COM,
OVM,LISTED FD TR SHARES MUNI DB,
OVS,LISTED FD TR SHARES SML CAP,
OVV,OVINTIV INC COM,"Susquehanna Securities, LLC"
OXBR,OXBRIDGE RE HLDGS LTD SHS,
OXBRW,OXBRIDGE RE HLDGS LTD WT EXP 032624,
OXFD,OXFORD IMMUNOTEC GLOBAL PLC ORD SHS,
OXLC,OXFORD LANE CAP CORP COM,
OXLCM,OXFORD LANE CAP CORP 6.75% PF TRM 24,
OXLCO,OXFORD LANE CAP CORP PFD SHS SER 2023,
OXLCP,OXFORD LANE CAP CORP 6.25% NT 27,
OXM,OXFORD INDS INC COM,"Susquehanna Securities, LLC"
OXSQ,OXFORD SQUARE CAP CORP COM,"Wolverine Trading, LLC"
OXSQL,OXFORD SQUARE CAP CORP 6.50% NT 24,
OXSQZ,OXFORD SQUARE CAP CORP CAL NT 26,
OXY,OCCIDENTAL PETE CORP COM,GTS Securities LLC
OXY+,OCCIDENTAL PETE CORP WT EXP 080327,
OYST,OYSTER PT PHARMA INC COM,
OZK,BANK OZK COM,Morgan Stanley & Co. LLC
OZON,OZON HLDGS PLC SPONSORED ADS,
PAA,PLAINS ALL AMERN PIPELINE L P UNIT LTD PARTN,"Susquehanna Securities, LLC"
PAAS,PAN AMERN SILVER CORP COM,"Two Sigma Securities, LLC"
PAASF,PAN AMERN SILVER CORP RT,
PAC,GRUPO AEROPUERTO DEL PACIFICO SPON ADR B,
PACB,PACIFIC BIOSCIENCES CALIF INC COM,"Group One Trading, L.P."
PACE,TPG PACE TECH OPPORTUNITIES CO CL A COM,
PACE+,TPG PACE TECH OPPORTUNITIES CO WT EX 100927,
PACE=,TPG PACE TECH OPPORTUNITIES CO UNIT EX,
PACK,RANPAK HOLDINGS CORP COM CL A,
PACW,PACWEST BANCORP DEL COM,"Susquehanna Securities, LLC"
PAE,PAE INC COM CL A,
PAEWW,PAE INC WT EXP 091123,
PAG,PENSKE AUTOMOTIVE GRP INC COM,GTS Securities LLC
PAGP,PLAINS GP HLDGS L P LTD PARTNR INT A,"Susquehanna Securities, LLC"
PAGS,PAGSEGURO DIGITAL LTD COM CL A,"Susquehanna Securities, LLC"
PAHC,PHIBRO ANIMAL HEALTH CORP CL A COM,
PAI,WESTERN ASSET INVESTMENT GRADE COM,
PAIC,PETRA ACQUISITION INC COM,
PAICU,PETRA ACQUISITION INC UNIT EXP 052527,
PAICW,PETRA ACQUISITION INC WT EXP 052527,
PAK,GLOBAL X FDS MSCI PAKISTAN,
PALC,PACER FDS TR LUNT LRGCP MULTI,
PALL,ABERDEEN STD PALLADIUM ETF TR PHYSCL PALLADM,
PAM,PAMPA ENERGIA S A SPONS ADR LVL I,"Wolverine Trading, LLC"
PAMC,PACER FDS TR LUNT MDCAP MLT,
PANA,PANACEA ACQUISITION CORP CL A,
PANA+,PANACEA ACQUISITION CORP WT EXP 070727,
PANA=,PANACEA ACQUISITION CORP UNIT,
PAND,PANDION THERAPEUTICS INC COM,
PANL,PANGAEA LOGISTICS SOLUTION LTD SHS,
PANW,PALO ALTO NETWORKS INC COM,"Susquehanna Securities, LLC"
PAPR,INNOVATOR ETFS TR S&P 500 PWR BU,
PAR,PAR TECHNOLOGY CORP COM,
PARR,PAR PAC HOLDINGS INC COM NEW,"Wolverine Trading, LLC"
PASG,PASSAGE BIO INC COM,
PATI,PATRIOT TRANSN HLDG INC COM,
PATK,PATRICK INDS INC COM,"Susquehanna Securities, LLC"
PAUG,INNOVATOR ETFS TR S&P 500 PWR BU,
PAVE,GLOBAL X FDS US INFR DEV ETF,Belvedere Trading LLC
PAVM,PAVMED INC COM,
PAVMW,PAVMED INC WT EXP 012922,
PAVMZ,PAVMED INC WT Z EXP 043024,
PAWZ,PROSHARES TR PET CARE ETF,
PAYA,PAYA HOLDINGS INC COM CL A,"Susquehanna Securities, LLC"
PAYAW,PAYA HOLDINGS INC WT EXP 101625,
PAYC,PAYCOM SOFTWARE INC COM,Citadel Securities LLC
PAYS,PAYSIGN INC COM,Belvedere Trading LLC
PAYX,PAYCHEX INC COM,Citadel Securities LLC
PB,PROSPERITY BANCSHARES INC COM,
PBA,PEMBINA PIPELINE CORP COM,"Group One Trading, L.P."
PBB,PROSPECT CAP CORP 6.25% NTS 2024,
PBC,PROSPECT CAP CORP 6.875 NTS DUE 29,
PBCT,PEOPLES UNITED FINANCIAL INC COM,GTS Securities LLC
PBCTP,PEOPLES UNITED FINANCIAL INC PERP PFD SER A,
PBD,INVESCO EXCH TRADED FD TR II GBL CLEAN ENRG,
PBDM,INVESCO EXCH TRADED FD TR II PURBTA FTSE DV,
PBE,INVESCO EXCHANGE TRADED FD TR DYNMC BIOTECH,
PBEE,INVESCO EXCH TRADED FD TR II PURBTA FTSE EM,
PBF,PBF ENERGY INC CL A,"Susquehanna Securities, LLC"
PBFS,PIONEER BANCORP INC COM,
PBFX,PBF LOGISTICS LP UNIT LTD PTNR,"Susquehanna Securities, LLC"
PBH,PRESTIGE CONSMR HEALTHCARE INC COM,
PBHC,PATHFINDER BANCORP INC MD COM,
PBI,PITNEY BOWES INC COM,"Susquehanna Securities, LLC"
PBI-B,PITNEY BOWES INC NT 43,
PBIP,PRUDENTIAL BANCORP INC NEW COM,
PBJ,INVESCO EXCHANGE TRADED FD TR DYNMC FOOD BEV,
PBLA,PANBELA THERAPEUTICS INC COM,
PBND,INVESCO EXCH TRADED FD TR II PURBETA US AGG,
PBP,INVESCO EXCHANGE TRADED FD TR S&P500 BUY WRT,
PBPB,POTBELLY CORP COM,Morgan Stanley & Co. LLC
PBR,PETROLEO BRASILEIRO SA PETROBR SPONSORED ADR,Morgan Stanley & Co. LLC
PBR.A,PETROLEO BRASILEIRO SA PETROBR SP ADR NON VTG,
PBS,INVESCO EXCHANGE TRADED FD TR DYNMC MEDIA,
PBSM,INVESCO EXCH TRADED FD TR II PURBTA MSCI SM,
PBT,PERMIAN BASIN RTY TR UNIT BEN INT,Citadel Securities LLC
PBTP,INVESCO EXCH TRADED FD TR II PURBTA 0 5 YR,
PBTS,POWERBRIDGE TECHNLOGIES CO LTD ORD SHS,
PBUS,INVESCO EXCH TRADED FD TR II PURBTA MSCI US,
PBW,INVESCO EXCHANGE TRADED FD TR WILDERHIL CLAN,"Susquehanna Securities, LLC"
PBY,PROSPECT CAP CORP 6.25% NT 28,
PBYI,PUMA BIOTECHNOLOGY INC COM,"Susquehanna Securities, LLC"
PCAR,PACCAR INC COM,"Susquehanna Securities, LLC"
PCB,PCB BANCORP COM,
PCEF,INVESCO EXCH TRADED FD TR II CEF INM COMPSI,"Wolverine Trading, LLC"
PCF,HIGH INCOME SECS FD SHS BEN INT,
PCG,PG&E CORP COM,Citadel Securities LLC
PCG-A,PACIFIC GAS & ELEC CO PFD 1ST 6%,
PCG-B,PACIFIC GAS & ELEC CO PFD 1ST 5.50%,
PCG-C,PACIFIC GAS & ELEC CO PFD 1ST 5%,
PCG-D,PACIFIC GAS & ELEC CO PFD 1ST 5%,
PCG-E,PACIFIC GAS & ELEC CO PFD 1 SER A 5%,
PCG-G,PACIFIC GAS & ELEC CO PFD 1ST 4.80%,
PCG-H,PACIFIC GAS & ELEC CO PFD 1ST 4.50%,
PCG-I,PACIFIC GAS & ELEC CO PFD 1ST 4.36%,
PCGU,PG&E CORP EQUITY UNIT,
PCH,POTLATCHDELTIC CORPORATION COM,
PCI,PIMCO DYNAMIC CR INCOME FD COM SHS,
PCK,PIMCO CALIF MUN INCOME FD II COM,
PCM,PCM FD INC COM,
PCN,PIMCO CORPORATE & INCM STRG FD COM,
PCOM,POINTS INTL LTD COM NEW,"Susquehanna Securities, LLC"
PCPC=,PERIPHAS CAPITAL PARTNERING UNIT,
PCPL,CC NEUBERGER PRINCIPAL HLDNG I COM,
PCPL+,CC NEUBERGER PRINCIPAL HLDNG I WT EXP,
PCPL=,CC NEUBERGER PRINCIPAL HLDNG I UNIT,
PCQ,PIMCO CA MUNICIPAL INCOME FD COM,
PCRX,PACIRA BIOSCIENCES INC COM,"Susquehanna Securities, LLC"
PCSA,PROCESSA PHARMACEUTICALS INC COM NEW,
PCSB,PCSB FINL CORP COM,"Susquehanna Securities, LLC"
PCTI,PCTEL INC COM,
PCTY,PAYLOCITY HLDG CORP COM,"Susquehanna Securities, LLC"
PCVX,VAXCYTE INC COM,
PCY,INVESCO EXCH TRADED FD TR II EMRNG MKT SVRG,"Susquehanna Securities, LLC"
PCYG,PARK CITY GROUP INC COM NEW,"Wolverine Trading, LLC"
PCYO,PURE CYCLE CORP COM NEW,
PD,PAGERDUTY INC COM,Citadel Securities LLC
PDAC,PERIDOT ACQUISITION CORP SHS CL A,
PDAC+,PERIDOT ACQUISITION CORP WT EXP 113027,
PDAC=,PERIDOT ACQUISITION CORP UNIT,
PDBC,INVESCO ACTIVLY MANGD ETC FD T OPTIMUM YIELD,Belvedere Trading LLC
PDCE,PDC ENERGY INC COM,Citadel Securities LLC
PDCO,PATTERSON COS INC COM,"Susquehanna Securities, LLC"
PDD,PINDUODUO INC SPONSORED ADS,"Susquehanna Securities, LLC"
PDEC,INNOVATOR ETFS TR S&P 500 PWR BU,
PDEV,PRINCIPAL EXCHANGE-TRADED FDS INTL MLTFCTR ETF,
PDEX,PRO-DEX INC COLO COM NEW,
PDFS,PDF SOLUTIONS INC COM,"Wolverine Trading, LLC"
PDI,PIMCO DYNAMIC INCOME FD SHS,
PDLB,PDL CMNTY BANCORP COM,
PDLI,PDL BIOPHARMA INC COM,"Susquehanna Securities, LLC"
PDM,PIEDMONT OFFICE REALTY TR INC COM CL A,"Wolverine Trading, LLC"
PDN,INVESCO EXCH TRADED FD TR II FTSE RAFI SML,
PDP,INVESCO EXCHANGE TRADED FD TR DWA MOMENTUM,Belvedere Trading LLC
PDS,PRECISION DRILLING CORP COM NEW,Morgan Stanley & Co. LLC
PDSB,PDS BIOTECHNOLOGY CORP COM,
PDT,HANCOCK JOHN PREM DIVID FD COM SH BEN INT,
PE,PARSLEY ENERGY INC CL A,"Susquehanna Securities, LLC"
PEAK,HEALTHPEAK PROPERTIES INC COM,GTS Securities LLC
PEB,PEBBLEBROOK HOTEL TR COM,"Susquehanna Securities, LLC"
PEB-C,PEBBLEBROOK HOTEL TR PFD SER C 6.50%,
PEB-D,PEBBLEBROOK HOTEL TR PFD SHS SER D,
PEB-E,PEBBLEBROOK HOTEL TR 6.375 PFD SER E,
PEB-F,PEBBLEBROOK HOTEL TR 6.3 CUM PFD SR F,
PEBK,PEOPLES BANCORP N C INC COM,
PEBO,PEOPLES BANCORP INC COM,
PECK,PECK CO HLDGS INC COM NEW,
PED,PEDEVCO CORP COM PAR,
PEG,PUBLIC SVC ENTERPRISE GRP INC COM,"Susquehanna Securities, LLC"
PEGA,PEGASYSTEMS INC COM,"Susquehanna Securities, LLC"
PEI,PENNSYLVANIA REAL ESTATE INVT SH BEN INT,"Group One Trading, L.P."
PEI-B,PENNSYLVANIA REAL ESTATE INVT CUM RED PERP PFD,
PEI-C,PENNSYLVANIA REAL ESTATE INVT RED PFD SER C,
PEI-D,PENNSYLVANIA REAL ESTATE INVT 6.875% RED PFD D,
PEIX,PACIFIC ETHANOL INC COM,"Group One Trading, L.P."
PEJ,INVESCO EXCHANGE TRADED FD TR DYNMC LEISURE,
PEN,PENUMBRA INC COM,"Susquehanna Securities, LLC"
PENN,PENN NATL GAMING INC COM,"Susquehanna Securities, LLC"
PEO,ADAM NAT RES FD INC COM,"Susquehanna Securities, LLC"
PEP,PEPSICO INC COM,"Susquehanna Securities, LLC"
PERI,PERION NETWORK LTD SHS NEW,"Susquehanna Securities, LLC"
PERS,SANDRIDGE PERMIAN TR COM UNIT BEN INT,Morgan Stanley & Co. LLC
PESI,PERMA-FIX ENVIRONMENTAL SVCS COM NEW,
PESXQ,PIONEER ENERGY SVCS CORP COM,
PETQ,PETIQ INC COM CL A,"Wolverine Trading, LLC"
PETS,PETMED EXPRESS INC COM,"Group One Trading, L.P."
PETZ,TDH HLDGS INC SHS,
PEX,PROSHARES TR PRIV EQTY-LSTD,
PEXL,PACER FDS TR US EXPORT LEAD,
PEY,INVESCO EXCHANGE TRADED FD TR HIG YLD EQ DIV,Belvedere Trading LLC
PEZ,INVESCO EXCHANGE TRADED FD TR DWA CYCLICALS,
PFBC,PREFERRED BK LOS ANGELES CA COM NEW,
PFBI,PREMIER FINL BANCORP INC COM,
PFC,PREMIER FINANCIAL CORP COM,
PFD,FLAHERTY & CRUMRINE PFD INCOME COM,
PFE,PFIZER INC COM,"Susquehanna Securities, LLC"
PFEB,INNOVATOR ETFS TR S&P 500 POWER,
PFF,ISHARES TR PFD AND INCM SEC,"Susquehanna Securities, LLC"
PFFA,ETFIS SER TR I VIRTUS INFRCAP,
PFFD,GLOBAL X FDS US PFD ETF,
PFFL,UBS AG LONDON BRANCH ETRACS 2XM ETN,
PFFR,ETFIS SER TR I INFRACP REIT PFD,
PFFV,GLOBAL X FDS RATE PREFERRED,
PFG,PRINCIPAL FINANCIAL GROUP INC COM,GTS Securities LLC
PFGC,PERFORMANCE FOOD GROUP CO COM,"Wolverine Trading, LLC"
PFH,PRUDENTIAL FINL INC CAL NT 60,
PFHD,PROFESSIONAL HLDG CORP CL A COM,
PFI,INVESCO EXCHANGE TRADED FD TR DWA FINL MUMT,
PFIE,PROFIRE ENERGY INC COM,
PFIG,INVESCO EXCH TRADED FD TR II FNDMNTL IG CRP,
PFIN,P & F INDS INC CL A NEW,
PFIS,PEOPLES FINL SVCS CORP COM,
PFL,PIMCO INCOME STRATEGY FD COM,
PFLD,ETF SER SOLUTIONS AAM LW DUR PFD,
PFLT,PENNANTPARK FLOATING RATE CAP COM,
PFM,INVESCO EXCHANGE TRADED FD TR DIVID ACHIEVEV,
PFMT,PERFORMANT FINL CORP COM,"Wolverine Trading, LLC"
PFN,PIMCO INCOME STRATEGY FD II COM,
PFO,FLAHERTY & CRUMRINE PFD INCOME COM,
PFPT,PROOFPOINT INC COM,Citadel Securities LLC
PFS,PROVIDENT FINL SVCS INC COM,"Wolverine Trading, LLC"
PFSI,PENNYMAC FINL SVCS INC NEW COM,Citadel Securities LLC
PFSW,PFSWEB INC COM NEW,
PFXF,VANECK VECTORS ETF TR PFD SECS EX FINL,
PG,PROCTER AND GAMBLE CO COM,GTS Securities LLC
PGAL,GLOBAL X FDS GBL X MSCI PT ET,
PGC,PEAPACK-GLADSTONE FINL CORP COM,
PGEN,PRECIGEN INC COM,"Group One Trading, L.P."
PGF,INVESCO EXCHANGE TRADED FD TR FINL PFD ETF,Citadel Securities LLC
PGHEF,PENGROWTH ENERGY CORP COM,
PGHY,INVESCO EXCH TRADED FD TR II GBL SRT TRM HY,
PGJ,INVESCO EXCHANGE TRADED FD TR GLOBAL DRGN CN,Citadel Securities LLC
PGM,BARCLAYS BANK PLC ETN LKD 48,
PGNY,PROGYNY INC COM,"Group One Trading, L.P."
PGP,PIMCO GLOBAL STOCKSPLS INCM FD COM,
PGR,PROGRESSIVE CORP COM,"Susquehanna Securities, LLC"
PGRE,PARAMOUNT GROUP INC COM,"Group One Trading, L.P."
PGTI,PGT INNOVATIONS INC COM,"Wolverine Trading, LLC"
PGX,INVESCO EXCH TRADED FD TR II PFD ETF,"Susquehanna Securities, LLC"
PGZ,PRINCIPAL REAL ESTATE INCOME SHS BEN INT,
PH,PARKER-HANNIFIN CORP COM,GTS Securities LLC
PHAS,PHASEBIO PHARMACEUTICALS INC COM,
PHAT,PHATHOM PHARMACEUTICALS INC COM,
PHB,INVESCO EXCH TRADED FD TR II FNDMNTL HY CRP,Citadel Securities LLC
PHCF,PUHUI WEALTH INVT MGMT CO LTD SHS,
PHD,PIONEER FLOATING RATE TR COM,
PHDG,INVESCO ACTIVELY MANAGED ETF S&P500 DOWNSID,
PHG,KONINKLIJKE PHILIPS N V NY REG SH NEW,Citadel Securities LLC
PHGE,BIOMX INC COM,
PHGE+,BIOMX INC WT EXP 101624,
PHGE=,BIOMX INC UNIT EX 101624,
PHI,PLDT INC SPONSORED ADR,
PHICU,POPULATION HEALTH INVS CO INC UNIT EX,
PHII,PHI INC COM VTG,
PHIO,PHIO PHARMACEUTICALS CORP COM NEW,
PHIOW,PHIO PHARMACEUTICALS CORP WT EXP 122121,
PHK,PIMCO HIGH INCOME FD COM SHS,
PHM,PULTE GROUP INC COM,GTS Securities LLC
PHO,INVESCO EXCHANGE TRADED FD TR WATER RES ETF,"Susquehanna Securities, LLC"
PHR,PHREESIA INC COM,"Wolverine Trading, LLC"
PHT,PIONEER HIGH INCOME TR COM,
PHUN,PHUNWARE INC COM,
PHUNW,PHUNWARE INC WT EXP 122623,
PHX,PHX MINERALS INC CL A,"Wolverine Trading, LLC"
PHYL,PGIM ETF TR ACTV HY BD ETF,
PHYS,SPROTT PHYSICAL GOLD TR UNIT,
PI,IMPINJ INC COM,"Susquehanna Securities, LLC"
PIAI,PRIME IMPACT ACQUISITION I SHS CL A,
PIAI+,PRIME IMPACT ACQUISITION I WT EXP 100130,
PIAI=,PRIME IMPACT ACQUISITION I UNIT EX 100130,
PICB,INVESCO EXCH TRADED FD TR II INTL CORP BD,
PICK,ISHARES INC MSCI GBL ETF NEW,"Susquehanna Securities, LLC"
PICO,PICO HLDGS INC COM NEW,"Group One Trading, L.P."
PID,INVESCO EXCHANGE TRADED FD TR INTL DIVI ACHI,"Wolverine Trading, LLC"
PIE,INVESCO EXCH TRADED FD TR II DWA EMERG MKTS,Belvedere Trading LLC
PIFI,ETF SER SOLUTIONS CLERSHS PITON IN,
PII,POLARIS INC COM,GTS Securities LLC
PILL,DIREXION SHS ETF TR DAILY PHARMA,
PIM,PUTNAM MASTER INTER INCOME TR SH BEN INT,
PIN,INVESCO INDIA EXCHANGE-TRADED INDIA ETF,Citadel Securities LLC
PINC,PREMIER INC CL A,"Susquehanna Securities, LLC"
PINE,ALPINE INCOME PPTY TR INC COM,
PING,PING IDENTITY HLDG CORP COM,"Wolverine Trading, LLC"
PINS,PINTEREST INC CL A,Morgan Stanley & Co. LLC
PIO,INVESCO EXCH TRADED FD TR II GLOBAL WATER,
PIPP=,PINE IS ACQUISITION CORP UNIT EX,
PIPR,PIPER SANDLER COMPANIES COM,Citadel Securities LLC
PIRS,PIERIS PHARMACEUTICALS INC COM,
PIXY,SHIFTPIXY INC COM NEW,
PIZ,INVESCO EXCH TRADED FD TR II DWA DEV MKTS,"Susquehanna Securities, LLC"
PJAN,INNOVATOR ETFS TR S&P 500 POWER,
PJP,INVESCO EXCHANGE TRADED FD TR DYNMC PHRMCTLS,"Susquehanna Securities, LLC"
PJT,PJT PARTNERS INC COM CL A,"Wolverine Trading, LLC"
PJUL,INNOVATOR ETFS TR S&P 500 PWR,
PJUN,INNOVATOR ETFS TR S&P 500 PWR BU,
PK,PARK HOTELS RESORTS INC COM,Morgan Stanley & Co. LLC
PKB,INVESCO EXCHANGE TRADED FD TR DYNMC BLDG CON,
PKBK,PARKE BANCORP INC COM,
PKDSQ,PARKER DRILLING CO COM NEW,
PKE,PARK AEROSPACE CORP COM,
PKG,PACKAGING CORP AMER COM,"Two Sigma Securities, LLC"
PKI,PERKINELMER INC COM,"Susquehanna Securities, LLC"
PKO,PIMCO INCOME OPPORTUNITY FD COM,
PKOH,PARK-OHIO HLDGS CORP COM,
PKW,INVESCO EXCHANGE TRADED FD TR BUYBACK ACHIEV,"Susquehanna Securities, LLC"
PKX,POSCO SPONSORED ADR,"Susquehanna Securities, LLC"
PLAB,PHOTRONICS INC COM,
PLAG,PLANET GREEN HLDGS CORP COM,
PLAN,ANAPLAN INC COM,"Susquehanna Securities, LLC"
PLAT,WISDOMTREE TR GROWTH LEADERS,
PLAY,DAVE & BUSTERS ENTMT INC COM,"Wolverine Trading, LLC"
PLBC,PLUMAS BANCORP COM,
PLCE,CHILDRENS PL INC COM,GTS Securities LLC
PLD,PROLOGIS INC. COM,"Susquehanna Securities, LLC"
PLG,PLATINUM GROUP METALS LTD COM,
PLIN,CHINA XIANGTAI FOOD CO LTD SHS,
PLL,PIEDMONT LITHIUM LTD SPONSORED ADS,Citadel Securities LLC
PLM,POLYMET MNG CORP COM NEW,
PLMR,PALOMAR HLDGS INC COM,Citadel Securities LLC
PLNT,PLANET FITNESS INC CL A,Morgan Stanley & Co. LLC
PLOW,DOUGLAS DYNAMICS INC COM,Belvedere Trading LLC
PLPC,PREFORMED LINE PRODS CO COM,
PLRX,PLIANT THERAPEUTICS INC COM,
PLSE,PULSE BIOSCIENCES INC COM,"Wolverine Trading, LLC"
PLT,PLANTRONICS INC NEW COM,Citadel Securities LLC
PLTM,GRANITESHARES PLATINUM TR SHS BEN INT,
PLTR,PALANTIR TECHNOLOGIES INC CL A,Morgan Stanley & Co. LLC
PLUG,PLUG POWER INC COM NEW,Morgan Stanley & Co. LLC
PLUS,EPLUS INC COM,
PLW,INVESCO EXCH TRADED FD TR II 1 30 LADER TRE,
PLX,PROTALIX BIOTHERAPEUTICS INC COM,"Group One Trading, L.P."
PLXP,PLX PHARMA INC COM,
PLXS,PLEXUS CORP COM,"Wolverine Trading, LLC"
PLYA,PLAYA HOTELS & RESORTS NV SHS,
PLYM,PLYMOUTH INDL REIT INC COM,
PLYM-A,PLYMOUTH INDL REIT INC 7.50% PFD A,
PM,PHILIP MORRIS INTL INC COM,"Susquehanna Securities, LLC"
PMAR,INNOVATOR ETFS TR S&P 500 PWR BUFR,
PMAY,INNOVATOR ETFS TR S&P 500 PWR BUF,
PMBC,PACIFIC MERCANTILE BANCORP COM,
PMD,PSYCHEMEDICS CORP COM NEW,
PME,PINGTAN MARINE ENTERPRISE LTD SHS,
PMF,PIMCO MUN INCOME FD COM,
PML,PIMCO MUN INCOME FD II COM,
PMM,PUTNAM MANAGED MUN INCOME TR COM,
PMO,PUTNAM MUN OPPORTUNITIES TR SH BEN INT,
PMT,PENNYMAC MTG INVT TR COM,"Wolverine Trading, LLC"
PMT-A,PENNYMAC MTG INVT TR PFD SER A,
PMT-B,PENNYMAC MTG INVT TR CUM RED PFD B,
PMTS,CPI CARD GROUP INC COM NEW,
PMVC,PMV CONSUMER ACQUISITION CORP COM,
PMVC+,PMV CONSUMER ACQUISITION CORP WT EXP 083127,
PMVC=,PMV CONSUMER ACQUISITION CORP UNIT EX 083127,
PMVP,PMV PHARMACEUTICALS INC COM,
PMX,PIMCO MUN INCOME FD III COM,
PNBK,PATRIOT NATL BANCORP INC COM NEW,
PNC,PNC FINL SVCS GROUP INC COM,Citadel Securities LLC
PNC-P,PNC FINL SVCS GROUP INC DEPOSITARY SHS P,
PNF,PIMCO NEW YORK MUN INCOME FD COM,
PNFP,PINNACLE FINL PARTNERS INC COM,"Wolverine Trading, LLC"
PNFPP,PINNACLE FINL PARTNERS INC 6.75 DP RP PFD B,
PNI,PIMCO NEW YORK MUN FD II COM,
PNM,PNM RES INC COM,Belvedere Trading LLC
PNNT,PENNANTPARK INVT CORP COM,"Wolverine Trading, LLC"
PNNTG,PENNANTPARK INVT CORP NT 24,
PNOV,INNOVATOR ETFS TR S&P 500 POWER,
PNQI,INVESCO EXCHANGE TRADED FD TR NASDAQ INTERNT,"Susquehanna Securities, LLC"
PNR,PENTAIR PLC SHS,"Wolverine Trading, LLC"
PNRG,PRIMEENERGY RESOURCES CORP COM,
PNTG,PENNANT GROUP INC COM,Belvedere Trading LLC
PNTPQ,PATRIOT NATL INC COM,
PNW,PINNACLE WEST CAP CORP COM,"Group One Trading, L.P."
POAI,PREDICTIVE ONCOLOGY INC COM NEW,
POCT,INNOVATOR ETFS TR S&P 500 PWRETF,
PODD,INSULET CORP COM,Citadel Securities LLC
POLA,POLAR PWR INC COM,
POOL,POOL CORP COM,GTS Securities LLC
POR,PORTLAND GEN ELEC CO COM NEW,Citadel Securities LLC
POST,POST HLDGS INC COM,"Susquehanna Securities, LLC"
POTX,GLOBAL X FDS CANNABIS ETF,
POWI,POWER INTEGRATIONS INC COM,"Wolverine Trading, LLC"
POWL,POWELL INDS INC COM,
POWW,AMMO INC COM,
PPA,INVESCO EXCHANGE TRADED FD TR AEROSPACE DEFN,"Wolverine Trading, LLC"
PPBI,PACIFIC PREMIER BANCORP COM,
PPBT,PURPLE BIOTECH LTD SPONSORED ADS,
PPC,PILGRIMS PRIDE CORP COM,Citadel Securities LLC
PPD,PPD INC COM,"Group One Trading, L.P."
PPG,PPG INDS INC COM,GTS Securities LLC
PPH,VANECK VECTORS ETF TR PHARMACEUTICAL,Belvedere Trading LLC
PPHI,POSITIVE PHYSICIANS HLDGS INC COM,
PPIH,PERMA-PIPE INTL HLDGS INC COM,
PPL,PPL CORP COM,GTS Securities LLC
PPLT,ABERDEEN STD PLATINUM ETF TR PHYSCL PLATM SHS,
PPR,VOYA PRIME RATE TR SH BEN INT,
PPSI,PIONEER PWR SOLUTIONS INC COM NEW,
PPT,PUTNAM PREMIER INCOME TR SH BEN INT,
PPTY,ETF SER SOLUTIONS US DIVERSIFIED,
PPX,PPL CAP FDG INC JR SUB NT-B 73,
PQDI,PRINCIPAL EXCHANGE-TRADED FDS SPECTRUM TAX ADV,
PQG,PQ GROUP HLDGS INC COM,"Susquehanna Securities, LLC"
PQIN,PGIM ETF TR QMA STRGC ALPH,
PQLC,PGIM ETF TR QMA STRATEGIC,
PQSG,PGIM ETF TR QMA STRGC GWTH,
PQSV,PGIM ETF TR QMA STRGIC VAL,
PQUE,PETROQUEST ENERGY INC COM NEW,
PRA,PROASSURANCE CORP COM,"Susquehanna Securities, LLC"
PRAA,PRA GROUP INC COM,"Susquehanna Securities, LLC"
PRAH,PRA HEALTH SCIENCES INC COM,"Susquehanna Securities, LLC"
PRAX,PRAXIS PRECISION MEDICINES INC COM,
PRDO,PERDOCEO ED CORP COM,"Susquehanna Securities, LLC"
PRE-G,PARTNERRE LTD PFD SER G 6.50%,
PRE-H,PARTNERRE LTD PFD SER H 7.25%,
PRE-I,PARTNERRE LTD PFD SER I 5.875%,
PREF,PRINCIPAL EXCHANGE-TRADED FDS SPECTRUM PFD,
PRF,INVESCO EXCHANGE TRADED FD TR FTSE RAFI 1000,"Susquehanna Securities, LLC"
PRFT,PERFICIENT INC COM,"Wolverine Trading, LLC"
PRFX,PAINREFORM LTD SHS,
PRFZ,INVESCO EXCHANGE TRADED FD TR FTSE RAFI 1500,"Wolverine Trading, LLC"
PRG,PROG HOLDINGS INC COM NPV,Citadel Securities LLC
PRGO,PERRIGO CO PLC SHS,"Wolverine Trading, LLC"
PRGS,PROGRESS SOFTWARE CORP COM,"Wolverine Trading, LLC"
PRGX,PRGX GLOBAL INC COM NEW,
PRI,PRIMERICA INC COM,"Wolverine Trading, LLC"
PRIF-A,PRIORITY INCOME FUND INC 6.375% PFD SER A,
PRIF-B,PRIORITY INCOME FUND INC 6.25% PFD B 23,
PRIF-C,PRIORITY INCOME FUND INC 6.625 PFD C,
PRIF-D,PRIORITY INCOME FUND INC 7% PFD SER D 29,
PRIF-E,PRIORITY INCOME FUND INC NT 24,
PRIF-F,PRIORITY INCOME FUND INC 6.625 PFD SER F,
PRIM,PRIMORIS SVCS CORP COM,"Wolverine Trading, LLC"
PRK,PARK NATL CORP COM,"Susquehanna Securities, LLC"
PRKR,PARKERVISION INC COM NEW,
PRLB,PROTO LABS INC COM,"Susquehanna Securities, LLC"
PRLD,PRELUDE THERAPEUTICS INC COM,
PRMW,PRIMO WATER CORPORATION COM,"Wolverine Trading, LLC"
PRN,INVESCO EXCHANGE TRADED FD TR DWA INDLS MUMT,
PRNT,ARK ETF TR 3D PRINTING ETF,
PRO,PROS HOLDINGS INC COM,"Susquehanna Securities, LLC"
PROF,PROFOUND MED CORP COM NEW,"Wolverine Trading, LLC"
PROG,PROGENITY INC COM,
PROS,PROSIGHT GLOBAL INC COM,
PROV,PROVIDENT FINL HLDGS INC COM,
PRPB,CC NEUBERGER PRIN HLDGS II SHS CL A,
PRPB+,CC NEUBERGER PRIN HLDGS II WT EXP 072925,
PRPB=,CC NEUBERGER PRIN HLDGS II UNITS,
PRPH,PROPHASE LABS INC COM,
PRPL,PURPLE INNOVATION INC COM,"Wolverine Trading, LLC"
PRPO,PRECIPIO INC COM,
PRQR,PROQR THRAPEUTICS N V SHS EURO,
PRS,PRUDENTIAL FINL INC 5.625% JR SB NT,
PRSC,THE PROVIDENCE SERVICE CORP COM,"Wolverine Trading, LLC"
PRSP,PERSPECTA INC COM,"Susquehanna Securities, LLC"
PRT,PERMROCK ROYALTY TRUST TR UNIT,
PRTA,PROTHENA CORP PLC SHS,Citadel Securities LLC
PRTC,PURETECH HEALTH PLC ADS,
PRTH,PRIORITY TECHNOLOGY HLDGS INC COM,
PRTHU,PRIORITY TECHNOLOGY HLDGS INC UNIT EX 111521,
PRTHW,PRIORITY TECHNOLOGY HLDGS INC WT EXP 111521,
PRTK,PARATEK PHARMACEUTICALS INC COM,Citadel Securities LLC
PRTS,CARPARTS COM INC COM,"Group One Trading, L.P."
PRTY,PARTY CITY HOLDCO INC COM,Citadel Securities LLC
PRU,PRUDENTIAL FINL INC COM,"Susquehanna Securities, LLC"
PRVB,PROVENTION BIO INC COM,
PRVL,PREVAIL THERAPEUTICS INC COM,
PS,PLURALSIGHT INC COM CL A,Citadel Securities LLC
PSA,PUBLIC STORAGE COM,"Susquehanna Securities, LLC"
PSA-B,PUBLIC STORAGE DEP RPST PFD B,
PSA-C,PUBLIC STORAGE DEP SHS PFD C,
PSA-D,PUBLIC STORAGE DEP SHS PFD D,
PSA-E,PUBLIC STORAGE PFD BEN INT E,
PSA-F,PUBLIC STORAGE PFD SHS F 5.15%,
PSA-G,PUBLIC STORAGE 5.05% CUM PFD G,
PSA-H,PUBLIC STORAGE 5.60 DEPSHS RP H,
PSA-I,PUBLIC STORAGE 4.875% DP SH PFD,
PSA-J,PUBLIC STORAGE 4.7% DP SH PF J,
PSA-K,PUBLIC STORAGE 4.75 DP PFD SH K,
PSA-L,PUBLIC STORAGE 4.625 DEP PFD L,
PSA-M,PUBLIC STORAGE 4.125 DP SH PF M,
PSA-N,PUBLIC STORAGE 3.875% DEP PFD N,
PSA-O,PUBLIC STORAGE 3.900% DEP PFD O,
PSAC,PROPERTY SOLUTIONS ACQUISITION COM,
PSACU,PROPERTY SOLUTIONS ACQUISITION UNIT EXP 033027,
PSACW,PROPERTY SOLUTIONS ACQUISITION WT EXP 033027,
PSB,PS BUSINESS PKS INC CALIF COM,"Wolverine Trading, LLC"
PSB-W,PS BUSINESS PKS INC CALIF DEP SHS RP PFD W,
PSB-X,PS BUSINESS PKS INC CALIF DEP SHS RP PFD X,
PSB-Y,PS BUSINESS PKS INC CALIF DEP SHS RP PFD Y,
PSB-Z,PS BUSINESS PKS INC CALIF 4.875% CUM PFD Z,
PSC,PRINCIPAL EXCHANGE-TRADED FDS US SM MLT FC ETF,
PSCC,INVESCO EXCH TRADED FD TR II S&P SMLCP STAP,
PSCD,INVESCO EXCH TRADED FD TR II S&P SMLCP DISC,
