Symbol,CompanyName,DpmName
PIE,INVESCO EXCH TRADED FD TR II DWA EMERG MKTS,Belvedere Trading LLC
PII,POLARIS INC COM,GTS Securities LLC
PILL,DIREXION SHS ETF TR DAILY PHARMA,
PIN,INVESCO INDIA EXCHANGE-TRADED INDIA ETF,Citadel Securities LLC
PINC,PREMIER INC CL A,"Susquehanna Securities, LLC"
PING,PING IDENTITY HLDG CORP COM,"Wolverine Trading, LLC"
PINS,PINTEREST INC CL A,Morgan Stanley & Co. LLC
PIO,INVESCO EXCH TRADED FD TR II GLOBAL WATER,
PIPP,PINE IS ACQUISITION CORP CL A,Belvedere Trading LLC
PIPR,PIPER SANDLER COMPANIES COM,Citadel Securities LLC
PIRS,PIERIS PHARMACEUTICALS INC COM,
PIXY,SHIFTPIXY INC COM NEW,"Susquehanna Securities, LLC"
PIZ,INVESCO EXCH TRADED FD TR II DWA DEV MKTS,"Susquehanna Securities, LLC"
PJP,INVESCO EXCHANGE TRADED FD TR DYNMC PHRMCTLS,"Susquehanna Securities, LLC"
PJT,PJT PARTNERS INC COM CL A,"Wolverine Trading, LLC"
PK,PARK HOTELS & RESORTS INC COM,Morgan Stanley & Co. LLC
PKB,INVESCO EXCHANGE TRADED FD TR DYNMC BLDG CON,
PKE,PARK AEROSPACE CORP COM,
PKG,PACKAGING CORP AMER COM,"Two Sigma Securities, LLC"
PKI,PERKINELMER INC COM,"Susquehanna Securities, LLC"
PKOH,PARK-OHIO HLDGS CORP COM,
PKW,INVESCO EXCHANGE TRADED FD TR BUYBACK ACHIEV,"Susquehanna Securities, LLC"
PKX,POSCO SPONSORED ADR,"Susquehanna Securities, LLC"
PLAB,PHOTRONICS INC COM,
PLAN,ANAPLAN INC COM,"Susquehanna Securities, LLC"
PLAY,DAVE & BUSTERS ENTMT INC COM,"Wolverine Trading, LLC"
PLBY,PLBY GROUP INC COM,Belvedere Trading LLC
PLCE,CHILDRENS PL INC NEW COM,GTS Securities LLC
PLD,PROLOGIS INC. COM,"Susquehanna Securities, LLC"
PLG,PLATINUM GROUP METALS LTD COM,Belvedere Trading LLC
PLL,PIEDMONT LITHIUM INC COM,Citadel Securities LLC
PLMR,PALOMAR HLDGS INC COM,Citadel Securities LLC
PLNT,PLANET FITNESS INC CL A,Morgan Stanley & Co. LLC
PLOW,DOUGLAS DYNAMICS INC COM,Belvedere Trading LLC
PLRX,PLIANT THERAPEUTICS INC COM,
PLSE,PULSE BIOSCIENCES INC COM,"Wolverine Trading, LLC"
PLTK,PLAYTIKA HLDG CORP COM,Citadel Securities LLC
PLTR,PALANTIR TECHNOLOGIES INC CL A,Morgan Stanley & Co. LLC
PLUG,PLUG POWER INC COM NEW,Morgan Stanley & Co. LLC
PLUS,EPLUS INC COM,
PLX,PROTALIX BIOTHERAPEUTICS INC COM,"Group One Trading, L.P."
PLXP,PLX PHARMA INC COM,Belvedere Trading LLC
PLXS,PLEXUS CORP COM,"Wolverine Trading, LLC"
PLYA,PLAYA HOTELS & RESORTS NV SHS,"Wolverine Trading, LLC"
PM,PHILIP MORRIS INTL INC COM,"Susquehanna Securities, LLC"
PMCB,PHARMACYTE BIOTECH INC COM NEW,
PMT,PENNYMAC MTG INVT TR COM,"Wolverine Trading, LLC"
PMVP,PMV PHARMACEUTICALS INC COM,"Group One Trading, L.P."
PNC,PNC FINL SVCS GROUP INC COM,Citadel Securities LLC
PNFP,PINNACLE FINL PARTNERS INC COM,"Wolverine Trading, LLC"
PNM,PNM RES INC COM,Belvedere Trading LLC
PNNT,PENNANTPARK INVT CORP COM,"Wolverine Trading, LLC"
PNQI,INVESCO EXCHANGE TRADED FD TR NASDAQ INTERNT,"Susquehanna Securities, LLC"
PNR,PENTAIR PLC SHS,"Wolverine Trading, LLC"
PNTG,PENNANT GROUP INC COM,Belvedere Trading LLC
PNW,PINNACLE WEST CAP CORP COM,"Group One Trading, L.P."
PODD,INSULET CORP COM,Citadel Securities LLC
POLY,PLANTRONICS INC NEW COM,Citadel Securities LLC
POOL,POOL CORP COM,GTS Securities LLC
POR,PORTLAND GEN ELEC CO COM NEW,Citadel Securities LLC
POSH,POSHMARK INC COM CL A,Morgan Stanley & Co. LLC
POST,POST HLDGS INC COM,"Susquehanna Securities, LLC"
POTX,GLOBAL X FDS CANNABIS ETF,Citadel Securities LLC
POWI,POWER INTEGRATIONS INC COM,"Wolverine Trading, LLC"
POWW,AMMO INC COM,Belvedere Trading LLC
PPA,INVESCO EXCHANGE TRADED FD TR AEROSPACE DEFN,"Wolverine Trading, LLC"
PPBI,PACIFIC PREMIER BANCORP COM,
PPBT,PURPLE BIOTECH LTD SPONSORED ADS,Belvedere Trading LLC
PPC,PILGRIMS PRIDE CORP COM,Citadel Securities LLC
PPD,PPD INC COM,"Group One Trading, L.P."
PPG,PPG INDS INC COM,GTS Securities LLC
PPH,VANECK ETF TRUST PHARMACEUTCL ETF,Belvedere Trading LLC
PPL,PPL CORP COM,GTS Securities LLC
PPTA,PERPETUA RESOURCES CORP COM,
PRA,PROASSURANCE CORP COM,"Susquehanna Securities, LLC"
PRAA,PRA GROUP INC COM,"Susquehanna Securities, LLC"
PRAX,PRAXIS PRECISION MEDICINES INC COM,"Susquehanna Securities, LLC"
PRCH,PORCH GROUP INC COM,"Susquehanna Securities, LLC"
PRDO,PERDOCEO ED CORP COM,"Susquehanna Securities, LLC"
PRF,INVESCO EXCHANGE TRADED FD TR FTSE RAFI 1000,"Susquehanna Securities, LLC"
PRFT,PERFICIENT INC COM,"Wolverine Trading, LLC"
PRFZ,INVESCO EXCHANGE TRADED FD TR FTSE RAFI 1500,"Wolverine Trading, LLC"
PRG,PROG HOLDINGS INC COM NPV,Citadel Securities LLC
PRGO,PERRIGO CO PLC SHS,"Wolverine Trading, LLC"
PRGS,PROGRESS SOFTWARE CORP COM,"Wolverine Trading, LLC"
PRI,PRIMERICA INC COM,"Wolverine Trading, LLC"
PRIM,PRIMORIS SVCS CORP COM,"Wolverine Trading, LLC"
PRK,PARK NATL CORP COM,"Susquehanna Securities, LLC"
PRLB,PROTO LABS INC COM,"Susquehanna Securities, LLC"
PRMW,PRIMO WATER CORPORATION COM,"Wolverine Trading, LLC"
PRN,INVESCO EXCHANGE TRADED FD TR DWA INDLS MUMT,
PRNT,ARK ETF TR 3D PRINTING ETF,Belvedere Trading LLC
PRO,PROS HOLDINGS INC COM,"Susquehanna Securities, LLC"
PROF,PROFOUND MED CORP COM NEW,"Wolverine Trading, LLC"
PROG,PROGENITY INC COM,"Wolverine Trading, LLC"
PRPB,CC NEUBERGER PRIN HLDGS II SHS CL A,"Susquehanna Securities, LLC"
PRPH,PROPHASE LABS INC COM,Belvedere Trading LLC
PRPL,PURPLE INNOVATION INC COM,"Wolverine Trading, LLC"
PRPO,PRECIPIO INC COM,"Susquehanna Securities, LLC"
PRQR,PROQR THRAPEUTICS N V SHS EURO,"Susquehanna Securities, LLC"
PRSR,PROSPECTOR CAPITAL CORP CL A,Belvedere Trading LLC
PRTA,PROTHENA CORP PLC SHS,Citadel Securities LLC
PRTK,PARATEK PHARMACEUTICALS INC COM,Citadel Securities LLC
PRTS,CARPARTS COM INC COM,"Group One Trading, L.P."
PRTY,PARTY CITY HOLDCO INC COM,Citadel Securities LLC
PRU,PRUDENTIAL FINL INC COM,"Susquehanna Securities, LLC"
PRVA,PRIVIA HEALTH GROUP INC COM,Citadel Securities LLC
PRVB,PROVENTION BIO INC COM,Citadel Securities LLC
PSA,PUBLIC STORAGE COM,"Susquehanna Securities, LLC"
PSB,PS BUSINESS PKS INC CALIF COM,"Wolverine Trading, LLC"
PSCC,INVESCO EXCH TRADED FD TR II S&P SMLCP STAP,
PSCD,INVESCO EXCH TRADED FD TR II S&P SMLCP DISC,
PSCE,INVESCO EXCH TRADED FD TR II S&P SMLCP ENGY,Belvedere Trading LLC
PSCF,INVESCO EXCH TRADED FD TR II S&P SMLCP FINL,
PSCH,INVESCO EXCH TRADED FD TR II S&P SMLCP HELT,Belvedere Trading LLC
PSCI,INVESCO EXCH TRADED FD TR II S&P SMLCP INDL,
PSCM,INVESCO EXCH TRADED FD TR II S&P SMLCP MATL,
PSCT,INVESCO EXCH TRADED FD TR II S&P SMLCP INFO,
PSEC,PROSPECT CAP CORP COM,Citadel Securities LLC
PSEP,INNOVATOR ETFS TR US EQTY PWR BUF,Belvedere Trading LLC
PSFE,PAYSAFE LIMITED ORD,Belvedere Trading LLC
PSI,INVESCO EXCHANGE TRADED FD TR DYNMC SEMICNDT,"Wolverine Trading, LLC"
PSJ,INVESCO EXCHANGE TRADED FD TR DYNMC SOFTWARE,
PSL,INVESCO EXCHANGE TRADED FD TR DWA STAPLES,
PSMT,PRICESMART INC COM,"Susquehanna Securities, LLC"
PSN,PARSONS CORP DEL COM,"Wolverine Trading, LLC"
PSNL,PERSONALIS INC COM,
PSO,PEARSON PLC SPONSORED ADR,Belvedere Trading LLC
PSP,INVESCO EXCHANGE TRADED FD TR GBL LISTED PVT,"Susquehanna Securities, LLC"
PSQ,PROSHARES TR SHORT QQQ NEW,"Susquehanna Securities, LLC"
PST,PROSHARES TR PSHS ULSHT 7-10Y,Citadel Securities LLC
PSTG,PURE STORAGE INC CL A,Citadel Securities LLC
PSTH,PERSHING SQUARE TONTINE HLDGS COM CL A,Citadel Securities LLC
PSTI,PLURISTEM THERAPEUTICS INC COM NEW,Citadel Securities LLC
PSTX,POSEIDA THERAPEUTICS INC COM,
PSX,PHILLIPS 66 COM,"Susquehanna Securities, LLC"
PSXP,PHILLIPS 66 PARTNERS LP COM UNIT REP INT,"Susquehanna Securities, LLC"
PTBD,PACER FDS TR TRENDPILOT US BD,
PTC,PTC INC COM,GTS Securities LLC
PTCT,PTC THERAPEUTICS INC COM,"Susquehanna Securities, LLC"
PTE,POLARITYTE INC COM,"Group One Trading, L.P."
PTEN,PATTERSON-UTI ENERGY INC COM,Citadel Securities LLC
PTF,INVESCO EXCHANGE TRADED FD TR DWA TECHNOLOGY,
PTGX,PROTAGONIST THERAPEUTICS INC COM,Belvedere Trading LLC
PTH,INVESCO EXCHANGE TRADED FD TR DWA HEALTHCARE,
PTLC,PACER FDS TR TRENDP US LAR CP,Belvedere Trading LLC
PTMN,PORTMAN RIDGE FIN CORP COM NEW,"Wolverine Trading, LLC"
PTNQ,PACER FDS TR TRENDP 100 ETF,Belvedere Trading LLC
PTON,PELOTON INTERACTIVE INC CL A COM,Morgan Stanley & Co. LLC
PTR,PETROCHINA CO LTD SPONSORED ADR,GTS Securities LLC
PTRA,PROTERRA INC COM,"Susquehanna Securities, LLC"
PTVE,PACTIV EVERGREEN INC COM,
PUBM,PUBMATIC INC COM CL A,Citadel Securities LLC
PUI,INVESCO EXCHANGE TRADED FD TR DWA UTILS MUMT,
PUK,PRUDENTIAL PLC ADR,
PULS,PGIM ETF TR ULTRA SHORT,
PUMP,PROPETRO HLDG CORP COM,"Wolverine Trading, LLC"
PUTW,WISDOMTREE TR CBOE S&P 500,
PVAC,PENN VA CORP COM,"Wolverine Trading, LLC"
PVG,PRETIUM RES INC COM,"Group One Trading, L.P."
PVH,PVH CORPORATION COM,Citadel Securities LLC
PVL,PERMIANVILLE RTY TR TR UNIT,"Wolverine Trading, LLC"
PWB,INVESCO EXCHANGE TRADED FD TR DYNMC LRG GWTH,
PWFL,POWERFLEET INC COM,Belvedere Trading LLC
PWP,PERELLA WEINBERG PARTNERS CLASS A COM,"Wolverine Trading, LLC"
PWR,QUANTA SVCS INC COM,Citadel Securities LLC
PWSC,POWERSCHOOL HOLDINGS INC COM CL A,Citadel Securities LLC
PWV,INVESCO EXCHANGE TRADED FD TR DYNMC LRG VALU,
PXD,PIONEER NAT RES CO COM,GTS Securities LLC
PXE,INVESCO EXCHANGE TRADED FD TR DYNMC ENRG EXP,Citadel Securities LLC
PXF,INVESCO EXCH TRADED FD TR II FTSE RAFI DEV,
PXH,INVESCO EXCH TRADED FD TR II FTSE RAFI EMNG,Belvedere Trading LLC
PXI,INVESCO EXCHANGE TRADED FD TR DWA ENERGY MNT,
PXJ,INVESCO EXCHANGE TRADED FD TR DYNMC OIL GAS,"Susquehanna Securities, LLC"
PXLW,PIXELWORKS INC COM NEW,"Wolverine Trading, LLC"
PYPD,POLYPID LTD SHS,Belvedere Trading LLC
PYPL,PAYPAL HLDGS INC COM,Citadel Securities LLC
PYR,PYROGENESIS CDA INC COM,
PYZ,INVESCO EXCHANGE TRADED FD TR DWA BASIC MATL,
PZA,INVESCO EXCH TRADED FD TR II NATL AMT MUNI,
PZN,PZENA INVT MGMT INC CLASS A,
PZZA,PAPA JOHNS INTL INC COM,GTS Securities LLC
QABA,FIRST TR NASDAQ ABA CMNTY BK I UT COM SHS ETF,Belvedere Trading LLC
QADA,QAD INC CL A,Belvedere Trading LLC
QCLN,FIRST TR EXCHANGE-TRADED FD NAS CLNEDG GREEN,Belvedere Trading LLC
QCOM,QUALCOMM INC COM,"Susquehanna Securities, LLC"
QCRH,QCR HOLDINGS INC COM,
QD,QUDIAN INC ADR,"Wolverine Trading, LLC"
QDEL,QUIDEL CORP COM,"Susquehanna Securities, LLC"
QDF,FLEXSHARES TR QUALT DIVD IDX,
QEFA,SPDR INDEX SHS FDS MSCI EAFE STRTGC,
QFIN,360 DIGITECH INC AMERICAN DEP,"Susquehanna Securities, LLC"
QGEN,QIAGEN NV SHS NEW,"Susquehanna Securities, LLC"
QID,PROSHARES TR ULTSHRT QQQ,Citadel Securities LLC
QIPT,QUIPT HOME MEDICAL CORP COM,"Wolverine Trading, LLC"
QIWI,QIWI PLC SPON ADR REP B,"Susquehanna Securities, LLC"
QLD,PROSHARES TR PSHS ULTRA QQQ,Citadel Securities LLC
QLGN,QUALIGEN THERAPEUTICS INC COM,Citadel Securities LLC
QLYS,QUALYS INC COM,"Susquehanna Securities, LLC"
QMCO,QUANTUM CORP COM NEW,
QNST,QUINSTREET INC COM,"Wolverine Trading, LLC"
QQEW,FIRST TR NAS100 EQ WEIGHTED IX SHS,"Susquehanna Securities, LLC"
QQH,NORTHERN LTS FD TR III HCM DEFND 100,
QQQ,INVESCO QQQ TR UNIT SER 1,"Wolverine Trading, LLC"
QQQE,DIREXION SHS ETF TR NAS100 EQL WGT,Belvedere Trading LLC
QQQJ,INVESCO EXCH TRADED FD TR II NASDAQNXTGEN100,Citadel Securities LLC
QQQM,INVESCO EXCH TRADED FD TR II NASDAQ 100 ETF,
QQXT,FIRST TR EXCHANGE-TRADED FD NASDAQ 100 EX,
QRHC,QUEST RESOURCE HLDG CORP COM NEW,
QRTEA,QURATE RETAIL INC COM SER A,"Susquehanna Securities, LLC"
QRVO,QORVO INC COM,"Susquehanna Securities, LLC"
QS,QUANTUMSCAPE CORP COM CL A,"Wolverine Trading, LLC"
QSI,QUANTUM SI INC COM CL A,Belvedere Trading LLC
QSR,RESTAURANT BRANDS INTL INC COM,Citadel Securities LLC
QTEC,FIRST TR NASDAQ 100 TECH INDX SHS,"Susquehanna Securities, LLC"
QTNT,QUOTIENT LTD SHS,"Wolverine Trading, LLC"
QTRX,QUANTERIX CORP COM,
QTT,QUTOUTIAO INC ADS REP SHS A,"Group One Trading, L.P."
QTUM,ETF SER SOLUTIONS DEFIANCE QUANT,
QTWO,Q2 HLDGS INC COM,Citadel Securities LLC
QUAD,QUAD / GRAPHICS INC COM CL A,"Susquehanna Securities, LLC"
QUAL,ISHARES TR MSCI USA QLT FCT,"Wolverine Trading, LLC"
QUBT,QUANTUM COMPUTING INC COM,"Susquehanna Securities, LLC"
QUIK,QUICKLOGIC CORP COM NEW,"Wolverine Trading, LLC"
QUMU,QUMU CORP COM,"Group One Trading, L.P."
QUOT,QUOTIENT TECHNOLOGY INC COM,"Wolverine Trading, LLC"
QURE,UNIQURE NV SHS,Citadel Securities LLC
QUS,SPDR SER TR MSCI USA STRTGIC,
QYLD,GLOBAL X FDS NASDAQ 100 COVER,"Wolverine Trading, LLC"
R,RYDER SYS INC COM,"Susquehanna Securities, LLC"
RAAS,CLOOPEN GROUP HOLDING LIMITED ADS,"Susquehanna Securities, LLC"
RACE,FERRARI N V COM,Citadel Securities LLC
RAD,RITE AID CORP COM,"Susquehanna Securities, LLC"
RADA,RADA ELECTR INDS LTD COM PAR NEW,"Wolverine Trading, LLC"
RADI,RADIUS GLOBAL INFRASTRCTRE INC COM CL A,
RAIL,FREIGHTCAR AMER INC COM,"Susquehanna Securities, LLC"
RAMP,LIVERAMP HLDGS INC COM,Citadel Securities LLC
RAPT,RAPT THERAPEUTICS INC COM,"Susquehanna Securities, LLC"
RARE,ULTRAGENYX PHARMACEUTICAL INC COM,Citadel Securities LLC
RAVE,RAVE RESTAURANT GROUP INC COM,Citadel Securities LLC
RAVN,RAVEN INDS INC COM,"Susquehanna Securities, LLC"
RBA,RITCHIE BROS AUCTIONEERS COM,"Susquehanna Securities, LLC"
RBAC,REDBALL ACQUISITION CORP COM CL A,"Susquehanna Securities, LLC"
RBBN,RIBBON COMMUNICATIONS INC COM,"Wolverine Trading, LLC"
RBCAA,REPUBLIC BANCORP INC KY CL A,
RBLX,ROBLOX CORP CL A,Citadel Securities LLC
RBOT,VICARIOUS SURGICAL INC COM CL A,"Group One Trading, L.P."
RC,READY CAPITAL CORP COM,
RCAT,RED CAT HLDGS INC COM,
RCD,INVESCO EXCHANGE TRADED FD TR S&P500 EQL DIS,Belvedere Trading LLC
RCEL,AVITA MEDICAL INC COM,
RCI,ROGERS COMMUNICATIONS INC CL B,"Wolverine Trading, LLC"
RCII,RENT A CTR INC NEW COM,GTS Securities LLC
RCKT,ROCKET PHARMACEUTICALS INC COM,Citadel Securities LLC
RCL,ROYAL CARIBBEAN GROUP COM,Citadel Securities LLC
RCM,R1 RCM INC COM,Citadel Securities LLC
RCMT,RCM TECHNOLOGIES INC COM NEW,"Wolverine Trading, LLC"
RCON,RECON TECHNOLOGY LTD CL A SHS,"Susquehanna Securities, LLC"
RCUS,ARCUS BIOSCIENCES INC COM,
RDFN,REDFIN CORP COM,Morgan Stanley & Co. LLC
RDHL,REDHILL BIOPHARMA LTD SPONSORED ADS,"Susquehanna Securities, LLC"
RDI,READING INTL INC CL A,Belvedere Trading LLC
RDIV,INVESCO EXCH TRADED FD TR II S&P ULTRA DIVIDE,
RDN,RADIAN GROUP INC COM,Morgan Stanley & Co. LLC
RDNT,RADNET INC COM,GTS Securities LLC
RDS.A,ROYAL DUTCH SHELL PLC SPONS ADR A,Citadel Securities LLC
RDS.B,ROYAL DUTCH SHELL PLC SPON ADR B,Citadel Securities LLC
RDUS,RADIUS HEALTH INC COM NEW,Citadel Securities LLC
RDVY,FIRST TR EXCHANGE-TRADED FD VI RISNG DIVD ACHIV,
RDW,REDWIRE CORPORATION COM,"Wolverine Trading, LLC"
RDWR,RADWARE LTD ORD,GTS Securities LLC
RDY,DR REDDYS LABS LTD ADR,Citadel Securities LLC
RE,EVEREST RE GROUP LTD COM,GTS Securities LLC
REAL,THE REALREAL INC COM,"Susquehanna Securities, LLC"
REDU,RISE ED CAYMAN LTD SPONSORED ADR,"Group One Trading, L.P."
REE,REE AUTOMOTIVE LTD CLASS A ORD SHS,Belvedere Trading LLC
REED,REEDS INC COM,"Group One Trading, L.P."
REET,ISHARES TR GLOBAL REIT ETF,"Wolverine Trading, LLC"
REFR,RESEARCH FRONTIERS INC COM,"Wolverine Trading, LLC"
REG,REGENCY CTRS CORP COM,"Susquehanna Securities, LLC"
REGI,RENEWABLE ENERGY GROUP INC COM NEW,"Susquehanna Securities, LLC"
REGL,PROSHARES TR S&P MDCP 400 DIV,"Wolverine Trading, LLC"
REGN,REGENERON PHARMACEUTICALS COM,GTS Securities LLC
REI,RING ENERGY INC COM,Belvedere Trading LLC
REK,PROSHARES TR SHRT RL EST FD,"Wolverine Trading, LLC"
REKR,REKOR SYSTEMS INC COM,"Wolverine Trading, LLC"
RELL,RICHARDSON ELECTRS LTD COM,
REM,ISHARES TR MORTGE REL ETF,"Susquehanna Securities, LLC"
REMX,VANECK ETF TRUST RARE EARTH/STRTG,"Susquehanna Securities, LLC"
RENN,RENREN INC SPONSORED ADS,"Susquehanna Securities, LLC"
REPH,RECRO PHARMA INC COM,"Susquehanna Securities, LLC"
REPL,REPLIMUNE GROUP INC COM,Citadel Securities LLC
RES,RPC INC COM,"Group One Trading, L.P."
RESN,RESONANT INC COM,"Susquehanna Securities, LLC"
RETA,REATA PHARMACEUTICALS INC CL A,Citadel Securities LLC
RETL,DIREXION SHS ETF TR RETAIL BULL 3X,Belvedere Trading LLC
REV,REVLON INC CL A NEW,GTS Securities LLC
REVG,REV GROUP INC COM,"Wolverine Trading, LLC"
REW,PROSHARES TR ULSHRT TECH NEW,"Wolverine Trading, LLC"
REXR,REXFORD INDL RLTY INC COM,"Wolverine Trading, LLC"
REYN,REYNOLDS CONSUMER PRODS INC COM,Citadel Securities LLC
REZ,ISHARES TR RESIDENTIAL MULT,"Susquehanna Securities, LLC"
REZI,RESIDEO TECHNOLOGIES INC COM,"Wolverine Trading, LLC"
RF,REGIONS FINANCIAL CORP NEW COM,"Susquehanna Securities, LLC"
RFIL,RF INDS LTD COM PAR $0.01,
RFL,RAFAEL HLDGS INC COM CL B,"Wolverine Trading, LLC"
RFP,RESOLUTE FST PRODS INC COM,"Susquehanna Securities, LLC"
RFV,INVESCO EXCHANGE TRADED FD TR S&P MDCP400 VL,Belvedere Trading LLC
RGA,REINSURANCE GRP OF AMERICA INC COM NEW,Morgan Stanley & Co. LLC
RGEN,REPLIGEN CORP COM,Citadel Securities LLC
RGI,INVESCO EXCHANGE TRADED FD TR S&P500 EQL IND,"Wolverine Trading, LLC"
RGLD,ROYAL GOLD INC COM,"Group One Trading, L.P."
RGLS,REGULUS THERAPEUTICS INC COM NEW,"Susquehanna Securities, LLC"
RGNX,REGENXBIO INC COM,Citadel Securities LLC
RGP,RESOURCES CONNECTION INC COM,"Susquehanna Securities, LLC"
RGR,STURM RUGER & CO INC COM,GTS Securities LLC
RGS,REGIS CORP MINN COM,Citadel Securities LLC
RH,RH COM,"Wolverine Trading, LLC"
RHI,ROBERT HALF INTL INC COM,GTS Securities LLC
RHP,RYMAN HOSPITALITY PPTYS INC COM,"Susquehanna Securities, LLC"
RICK,RCI HOSPITALITY HLDGS INC COM,"Susquehanna Securities, LLC"
RIDE,LORDSTOWN MOTORS CORP COM CL A,Citadel Securities LLC
RIG,TRANSOCEAN LTD REG SHS,"Susquehanna Securities, LLC"
RIGL,RIGEL PHARMACEUTICALS INC COM NEW,"Susquehanna Securities, LLC"
RILY,B. RILEY FINANCIAL INC COM,"Group One Trading, L.P."
RING,ISHARES INC MSCI GBL GOLD MN,"Susquehanna Securities, LLC"
RIO,RIO TINTO PLC SPONSORED ADR,"Susquehanna Securities, LLC"
RIOT,RIOT BLOCKCHAIN INC COM,"Susquehanna Securities, LLC"
RJA,SWEDISH EXPT CR CORP ROG AGRI ETN22,Citadel Securities LLC
RJF,RAYMOND JAMES FINL INC COM,GTS Securities LLC
RJI,SWEDISH EXPT CR CORP ROG TTL ETN 22,Citadel Securities LLC
RJN,SWEDISH EXPT CR CORP RG ENRGY ETN22,"Wolverine Trading, LLC"
RJZ,SWEDISH EXPT CR CORP RG METAL ETN22,
RKDA,ARCADIA BIOSCIENCES INC COM NEW,
RKLB,ROCKET LAB USA INC COM,"Susquehanna Securities, LLC"
RKLY,ROCKLEY PHOTONICS HOLDINGS LTD ORDINARY SHARES,Morgan Stanley & Co. LLC
RKT,ROCKET COS INC COM CL A,Citadel Securities LLC
RL,RALPH LAUREN CORP CL A,Citadel Securities LLC
RLAY,RELAY THERAPEUTICS INC COM,"Susquehanna Securities, LLC"
RLG,Russell 1000 Growth Index,"Susquehanna Securities, LLC"
RLGT,RADIANT LOGISTICS INC COM,"Susquehanna Securities, LLC"
RLGY,REALOGY HLDGS CORP COM,Morgan Stanley & Co. LLC
RLI,RLI CORP COM,"Susquehanna Securities, LLC"
RLJ,RLJ LODGING TR COM,"Wolverine Trading, LLC"
RLMD,RELMADA THERAPEUTICS INC COM,"Group One Trading, L.P."
RLV,Russell 1000 Value Index,"Susquehanna Securities, LLC"
RLX,RLX TECHNOLOGY INC SPONSORED ADS,Citadel Securities LLC
RM,REGIONAL MGMT CORP COM,
RMAX,RE MAX HLDGS INC CL A,Citadel Securities LLC
RMBS,RAMBUS INC DEL COM,"Susquehanna Securities, LLC"
RMD,RESMED INC COM,"Susquehanna Securities, LLC"
RMNI,RIMINI STR INC DEL COM,"Wolverine Trading, LLC"
RMO,ROMEO POWER INC COM,"Wolverine Trading, LLC"
RMTI,ROCKWELL MED INC COM,GTS Securities LLC
RNA,AVIDITY BIOSCIENCES INC COM,Belvedere Trading LLC
RNG,RINGCENTRAL INC CL A,"Wolverine Trading, LLC"
RNLX,RENALYTIX PLC ADS,Citadel Securities LLC
RNR,RENAISSANCERE HLDGS LTD COM,GTS Securities LLC
RNST,RENASANT CORP COM,
RNW,RENEW ENERGY GLOBAL PLC CL A SHS,"Wolverine Trading, LLC"
RNWK,REALNETWORKS INC COM NEW,Citadel Securities LLC
ROAD,CONSTRUCTION PARTNERS INC COM CL A,
ROBO,EXCHANGE TRADED CONCEPTS TR ROBO GLB ETF,Belvedere Trading LLC
ROBT,FIRST TR EXCHANGE-TRADED FD VI NASDQ ARTFCIAL,Belvedere Trading LLC
ROCK,GIBRALTAR INDS INC COM,Belvedere Trading LLC
RODM,LATTICE STRATEGIES TR HARTFORD MLT ETF,"Wolverine Trading, LLC"
ROG,ROGERS CORP COM,"Susquehanna Securities, LLC"
ROIC,RETAIL OPPORTUNITY INVTS CORP COM,Citadel Securities LLC
ROK,ROCKWELL AUTOMATION INC COM,"Wolverine Trading, LLC"
ROKU,ROKU INC COM CL A,Morgan Stanley & Co. LLC
ROL,ROLLINS INC COM,"Wolverine Trading, LLC"
ROLL,RBC BEARINGS INC COM,"Wolverine Trading, LLC"
ROM,PROSHARES TR PSHS ULTRA TECH,GTS Securities LLC
ROOT,ROOT INC COM CL A,"Susquehanna Securities, LLC"
ROP,ROPER TECHNOLOGIES INC COM,"Susquehanna Securities, LLC"
ROST,ROSS STORES INC COM,Citadel Securities LLC
ROVR,ROVER GROUP INC COM CL A,"Wolverine Trading, LLC"
RPAI,RETAIL PPTYS AMER INC CL A,"Susquehanna Securities, LLC"
RPAR,TIDAL ETF TR RPAR RISK PARI,Belvedere Trading LLC
RPAY,REPAY HLDGS CORP COM CL A,Citadel Securities LLC
RPD,RAPID7 INC COM,"Wolverine Trading, LLC"
RPG,INVESCO EXCHANGE TRADED FD TR S&P500 PUR GWT,
RPM,RPM INTL INC COM,GTS Securities LLC
RPRX,ROYALTY PHARMA PLC SHS CLASS A,Citadel Securities LLC
RPT,RPT REALTY SH BEN INT,"Wolverine Trading, LLC"
RPTX,REPARE THERAPEUTICS INC COM,
RPV,INVESCO EXCHANGE TRADED FD TR S&P500 PUR VAL,"Susquehanna Securities, LLC"
RRC,RANGE RES CORP COM,Citadel Securities LLC
RRD,DONNELLEY R R & SONS CO COM,Citadel Securities LLC
RRGB,RED ROBIN GOURMET BURGERS INC COM,Morgan Stanley & Co. LLC
RRR,RED ROCK RESORTS INC CL A,Morgan Stanley & Co. LLC
RRX,REGAL REXNORD CORPORATION COM,"Susquehanna Securities, LLC"
RS,RELIANCE STEEL & ALUMINUM CO COM,Citadel Securities LLC
RSG,REPUBLIC SVCS INC COM,Citadel Securities LLC
RSI,RUSH STREET INTERACTIVE INC COM,Belvedere Trading LLC
RSP,INVESCO EXCHANGE TRADED FD TR S&P500 EQL WGT,Belvedere Trading LLC
RSX,VANECK ETF TRUST VANECK RUSSIA ET,"Susquehanna Securities, LLC"
RTH,VANECK ETF TRUST RETAIL ETF,"Susquehanna Securities, LLC"
RTLR,RATTLER MIDSTREAM LP COM UNITS,"Wolverine Trading, LLC"
RTM,INVESCO EXCHANGE TRADED FD TR S&P500 EQL MAT,"Wolverine Trading, LLC"
RTPY,REINVENT TECHNOLOGY PARTNERS Y CLASS A ORD SHS,Belvedere Trading LLC
RTX,RAYTHEON TECHNOLOGIES CORP COM,"Susquehanna Securities, LLC"
RUBY,RUBIUS THERAPEUTICS INC COM,"Susquehanna Securities, LLC"
RUI,Russell 1000 Index,"Susquehanna Securities, LLC"
RUN,SUNRUN INC COM,Citadel Securities LLC
RUSHA,RUSH ENTERPRISES INC CL A,Belvedere Trading LLC
RUSL,DIREXION SHS ETF TR DLY RUSSIA BL 2X,"Susquehanna Securities, LLC"
RUT,Russell 2000 Index,"Susquehanna Securities, LLC"
RUTH,RUTHS HOSPITALITY GROUP INC COM,Citadel Securities LLC
RVLV,REVOLVE GROUP INC CL A,Citadel Securities LLC
RVMD,REVOLUTION MEDICINES INC COM,"Group One Trading, L.P."
RVNC,REVANCE THERAPEUTICS INC COM,"Group One Trading, L.P."
RVP,RETRACTABLE TECHNOLOGIES INC COM,Citadel Securities LLC
RVPH,REVIVA PHARMACEUTCLS HLDGS INC COM,
RVSB,RIVERVIEW BANCORP INC COM,
RWJ,INVESCO EXCH TRADED FD TR II S&P SMALLCAP 600,"Susquehanna Securities, LLC"
RWK,INVESCO EXCH TRADED FD TR II S&P MDCP 400 REV,"Susquehanna Securities, LLC"
RWL,INVESCO EXCH TRADED FD TR II S&P 500 REVENUE,"Susquehanna Securities, LLC"
RWLK,REWALK ROBOTICS LTD SHS,"Susquehanna Securities, LLC"
RWM,PROSHARES TR SHRT RUSSELL2000,Belvedere Trading LLC
RWO,SPDR INDEX SHS FDS DJ GLB RL ES ETF,"Susquehanna Securities, LLC"
RWR,SPDR SER TR DJ REIT ETF,"Susquehanna Securities, LLC"
RWT,REDWOOD TR INC COM,Citadel Securities LLC
RWX,SPDR INDEX SHS FDS DJ INTL RL ETF,"Susquehanna Securities, LLC"
RXDX,PROMETHEUS BIOSCIENCES INC COM,Citadel Securities LLC
RXL,PROSHARES TR PSHS ULT HLTHCRE,"Susquehanna Securities, LLC"
RXRX,RECURSION PHARMACEUTICALS INC CL A,Citadel Securities LLC
RXT,RACKSPACE TECHNOLOGY INC COM,Citadel Securities LLC
RY,ROYAL BK CDA COM,"Two Sigma Securities, LLC"
RYAAY,RYANAIR HOLDINGS PLC SPONSORED ADS,"Wolverine Trading, LLC"
RYAM,RAYONIER ADVANCED MATLS INC COM,Citadel Securities LLC
RYAN,RYAN SPECIALTY GROUP HLDGS INC CL A,"Susquehanna Securities, LLC"
RYB,RYB ED INC ADR,"Group One Trading, L.P."
RYE,INVESCO EXCHANGE TRADED FD TR S&P500 EQL ENR,
RYF,INVESCO EXCHANGE TRADED FD TR S&P500 EQL FIN,"Wolverine Trading, LLC"
RYH,INVESCO EXCHANGE TRADED FD TR S&P500 EQL HLT,Morgan Stanley & Co. LLC
RYI,RYERSON HLDG CORP COM,Citadel Securities LLC
RYN,RAYONIER INC COM,Citadel Securities LLC
RYT,INVESCO EXCHANGE TRADED FD TR S&P500 EQL TEC,Belvedere Trading LLC
RYTM,RHYTHM PHARMACEUTICALS INC COM,
RYU,INVESCO EXCHANGE TRADED FD TR S&P500 EQL UTL,
RZV,INVESCO EXCHANGE TRADED FD TR S&P SML600 VAL,Belvedere Trading LLC
S,SENTINELONE INC CL A,"Susquehanna Securities, LLC"
SA,SEABRIDGE GOLD INC COM,Citadel Securities LLC
SAA,PROSHARES TR PSHS ULT SCAP600,"Wolverine Trading, LLC"
SABR,SABRE CORP COM,"Wolverine Trading, LLC"
SACH,SACHEM CAP CORP COM,"Group One Trading, L.P."
SAFE,SAFEHOLD INC COM,"Group One Trading, L.P."
SAFM,SANDERSON FARMS INC COM,Citadel Securities LLC
SAFT,SAFETY INS GROUP INC COM,
SAGE,SAGE THERAPEUTICS INC COM,"Susquehanna Securities, LLC"
SAH,SONIC AUTOMOTIVE INC CL A,Citadel Securities LLC
SAIA,SAIA INC COM,
SAIC,SCIENCE APPLICATIONS INTL CORP COM,"Susquehanna Securities, LLC"
SAIL,SAILPOINT TECHNOLOGIES HLDGS I COM,"Wolverine Trading, LLC"
SAM,BOSTON BEER INC CL A,"Susquehanna Securities, LLC"
SAN,BANCO SANTANDER S.A. ADR,"Wolverine Trading, LLC"
SANA,SANA BIOTECHNOLOGY INC COM,Citadel Securities LLC
SAND,SANDSTORM GOLD LTD COM NEW,"Susquehanna Securities, LLC"
SANM,SANMINA CORPORATION COM,GTS Securities LLC
SANW,S&W SEED CO COM,Citadel Securities LLC
SAP,SAP SE SPON ADR,Citadel Securities LLC
SASR,SANDY SPRING BANCORP INC COM,
SATS,ECHOSTAR CORP CL A,"Susquehanna Securities, LLC"
SAVA,CASSAVA SCIENCES INC COM,"Group One Trading, L.P."
SAVE,SPIRIT AIRLS INC COM,"Wolverine Trading, LLC"
SB,SAFE BULKERS INC COM,Morgan Stanley & Co. LLC
SBAC,SBA COMMUNICATIONS CORP NEW CL A,Citadel Securities LLC
SBBP,STRONGBRIDGE BIOPHARMA PLC SHS USD,Belvedere Trading LLC
SBCF,SEACOAST BKG CORP FLA COM NEW,
SBGI,SINCLAIR BROADCAST GROUP INC CL A,"Wolverine Trading, LLC"
SBH,SALLY BEAUTY HLDGS INC COM,"Susquehanna Securities, LLC"
SBIO,ALPS ETF TR MED BREAKTHGH,Belvedere Trading LLC
SBLK,STAR BULK CARRIERS CORP. SHS PAR,"Susquehanna Securities, LLC"
SBM,PROSHARES TR SHT BASIC MAT,
SBNY,SIGNATURE BK NEW YORK N Y COM,"Susquehanna Securities, LLC"
SBOW,SILVERBOW RES INC COM,
SBRA,SABRA HEALTH CARE REIT INC COM,Belvedere Trading LLC
SBS,COMPANHIA DE SANEAMENTO BASICO SPONSORED ADR,"Group One Trading, L.P."
SBSI,SOUTHSIDE BANCSHARES INC COM,"Wolverine Trading, LLC"
SBSW,SIBANYE STILLWATER LTD SPONSORED ADR,"Susquehanna Securities, LLC"
SBTX,SILVERBACK THERAPEUTICS INC COM,
