Symbol,CompanyName,DpmName
MTNB,MATINAS BIOPHARMA HLDGS INC COM,
MTOR,MERITOR INC COM,"Susquehanna Securities, LLC"
MTP,MIDATECH PHARMA PLC SPONSORED ADS,
MTR,MESA RTY TR UNIT BEN INT,
MTRN,MATERION CORP COM,Citadel Securities LLC
MTRX,MATRIX SVC CO COM,"Wolverine Trading, LLC"
MTSC,MTS SYS CORP COM,
MTSI,MACOM TECH SOLUTIONS HLDGS INC COM,"Wolverine Trading, LLC"
MTSL,MER TELEMANAGEMENT SOLUTIONS SHS,
MTT,WESTERN ASSET MUN DEF OPP TR COM,
MTUM,ISHARES TR MSCI USA MMENTM,"Wolverine Trading, LLC"
MTW,MANITOWOC CO INC COM NEW,"Group One Trading, L.P."
MTX,MINERALS TECHNOLOGIES INC COM,"Susquehanna Securities, LLC"
MTZ,MASTEC INC COM,"Wolverine Trading, LLC"
MU,MICRON TECHNOLOGY INC COM,"Susquehanna Securities, LLC"
MUA,BLACKROCK MUNIASSETS FD INC COM,
MUB,ISHARES TR NATIONAL MUN ETF,Citadel Securities LLC
MUC,BLACKROCK MUNIHLDNGS CALI QLTY COM,
MUDSU,MUDRICK CAPITAL ACQU CORP II UNIT EX,
MUE,BLACKROCK MUNIHOLDINGS QUALITY COM,
MUFG,MITSUBISHI UFJ FINL GROUP INC SPONSORED ADS,Citadel Securities LLC
MUH,BLACKROCK MUNIHOLDINGS FD II I COM,
MUI,BLACKROCK MUNI INTER DR FD INC COM,
MUJ,BLACKROCK MUNIHLDGS NJ QLTY FD COM,
MUNI,PIMCO ETF TR INTER MUN BD ACT,"Susquehanna Securities, LLC"
MUR,MURPHY OIL CORP COM,"Susquehanna Securities, LLC"
MUS,BLACKROCK MUNIHOLDINGS QUALITY COM,
MUSA,MURPHY USA INC COM,"Susquehanna Securities, LLC"
MUST,COLUMBIA ETF TR I MULTI SEC MUNI,
MUX,MCEWEN MNG INC COM,"Susquehanna Securities, LLC"
MVBF,MVB FINL CORP COM,
MVC,MVC CAP INC COM,
MVCD,MVC CAP INC 6.25% SR NT 22,
MVF,BLACKROCK MUNIVEST FD INC COM,
MVIS,MICROVISION INC DEL COM NEW,"Wolverine Trading, LLC"
MVO,MV OIL TR TR UNITS,"Group One Trading, L.P."
MVRL,UBS AG LONDON BRANCH ETRACS LKD 50,
MVT,BLACKROCK MUNIVEST FD II INC COM,
MVV,PROSHARES TR PSHS ULT MCAP400,
MWA,MUELLER WTR PRODS INC COM SER A,
MWK,MOHAWK GROUP HLDGS INC COM,
MX,MAGNACHIP SEMICONDUCTOR CORP N COM,"Wolverine Trading, LLC"
MXC,MEXCO ENERGY CORP COM,
MXDU,ETF SER SOLUTIONS NATIONWIDE MAX,
MXE,MEXICO EQUITY & INCOME FD COM,
MXEA,MSCI Emerging Markets Index,"Susquehanna Securities, LLC"
MXEF,MSCI Emerging Markets Index,"Susquehanna Securities, LLC"
MXF,MEXICO FD INC COM,
MXI,ISHARES TR GLOBAL MATER ETF,Belvedere Trading LLC
MXIM,MAXIM INTEGRATED PRODS INC COM,"Wolverine Trading, LLC"
MXL,MAXLINEAR INC COM,Citadel Securities LLC
MYC,BLACKROCK MUNIYIELD CALIF FD I COM,
MYD,BLACKROCK MUNIYIELD FD INC COM,
MYE,MYERS INDS INC COM,"Group One Trading, L.P."
MYF,BLACKROCK MUNIYIELD INVT FD COM,
MYFW,FIRST WESTN FINL INC COM,
MYGN,MYRIAD GENETICS INC COM,"Susquehanna Securities, LLC"
MYI,BLACKROCK MUNIYIELD QUALITY FD COM,
MYJ,BLACKROCK MUNIYIELD N J FD INC COM,
MYN,BLACKROCK MUNIYIELD N Y QUALIT COM,
MYO,MYOMO INC COM NEW,
MYOV,MYOVANT SCIENCES LTD COM,"Susquehanna Securities, LLC"
MYRG,MYR GROUP INC DEL COM,"Wolverine Trading, LLC"
MYSZ,MY SIZE INC COM NEW,
MYT,URBAN TEA INC ORD SHS NEW,
MYY,PROSHARES TR PSHS SH MDCAP400,Belvedere Trading LLC
MZA,BLACKROCK MUNIYIELD ARIZ FD IN COM,
MZZ,PROSHARES TR ULTSHT MIDCAP400,Citadel Securities LLC
NAC,NUVEEN CA QUALTY MUN INCOME FD COM,
NACP,IMPACT SHS FDS I TR NAACP MINO ETF,
NAD,NUVEEN QUALITY MUNCP INCOME FD COM,
NAII,NATURAL ALTERNATIVES INTL INC COM NEW,
NAIL,DIREXION SHS ETF TR DALY HOM B&S BUL,Belvedere Trading LLC
NAK,NORTHERN DYNASTY MINERALS LTD COM NEW,"Susquehanna Securities, LLC"
NAKD,NAKED BRAND GROUP LIMITED SHS NEW,
NAN,NUVEEN NEW YORK QLT MUN INC FD COM,
NANR,SPDR INDEX SHS FDS S&P NORTH AMER,Belvedere Trading LLC
NAOV,NANOVIBRONIX INC COM,
NAPR,INNOVATOR ETFS TR NASDAQ 100 POWER,
NARI,INARI MED INC COM,"Susquehanna Securities, LLC"
NAT,NORDIC AMERICAN TANKERS LIMITE COM,"Group One Trading, L.P."
NATH,NATHANS FAMOUS INC NEW COM,
NATI,NATIONAL INSTRS CORP COM,
NATR,NATURES SUNSHINE PRODS INC COM,
NAV,NAVISTAR INTL CORP NEW COM,"Susquehanna Securities, LLC"
NAV-D,NAVISTAR INTL CORP NEW PFD SR D CONV,
NAVB,NAVIDEA BIOPHARMACEUTICALS INC COM NEW,"Wolverine Trading, LLC"
NAVI,NAVIENT CORPORATION COM,Citigroup Derivatives Markets Inc.
NAZ,NUVEEN ARIZONA QLTY MUN INC FD COM,
NBA,NEW BEGINNINGS ACQUISITION COR COM,
NBA+,NEW BEGINNINGS ACQUISITION COR WT EXP 110126,
NBA=,NEW BEGINNINGS ACQUISITION COR UNIT EX 110126,
NBAC,NEWBORN ACQUISITION CORP SHS,
NBACR,NEWBORN ACQUISITION CORP RT,
NBACU,NEWBORN ACQUISITION CORP UNIT EX,
NBACW,NEWBORN ACQUISITION CORP WT EXP 020325,
NBB,NUVEEN TAXABLE MUNICPAL INM FD COM,
NBEV,NEWAGE INC COM,"Wolverine Trading, LLC"
NBH,NEUBERGER BERMAN MUN FD INC COM,
NBHC,NATIONAL BK HLDGS CORP CL A,"Susquehanna Securities, LLC"
NBIX,NEUROCRINE BIOSCIENCES INC COM,"Susquehanna Securities, LLC"
NBLX,NOBLE MIDSTREAM PARTNERS LP COM UNIT REPST,Citadel Securities LLC
NBN,NORTHEAST BK LEWISTON ME COM,
NBO,NEUBERGER BRMAN NY MUNI FD INC COM,
NBR,NABORS INDUSTRIES LTD SHS,"Wolverine Trading, LLC"
NBR-A,NABORS INDUSTRIES LTD 6% PFD CNV SR A,
NBRV,NABRIVA THERAPEUTICS PLC SHS NEW,"Group One Trading, L.P."
NBSE,NEUBASE THERAPEUTICS INC COM,
NBTB,NBT BANCORP INC COM,
NBTX,NANOBIOTIX SA SPONSORED ADS,
NBW,NEUBERGER BRMAN CLIFRN MUNI FD COM,
NBY,NOVABAY PHARMACEUTICALS INC COM NEW,
NC,NACCO INDS INC CL A,
NCA,NUVEEN CALIF MUN VALUE FD INC COM,
NCB,NUVEEN CALIF MUNICPAL VALUE F COM,
NCBS,NICOLET BANKSHARES INC COM,
NCLH,NORWEGIAN CRUISE LINE HLDG LTD SHS,"Wolverine Trading, LLC"
NCMI,NATIONAL CINEMEDIA INC COM,Citadel Securities LLC
NCNA,NUCANA PLC SPONSORED ADR,
NCNO,NCINO INC COM,Citadel Securities LLC
NCR,NCR CORP NEW COM,Citadel Securities LLC
NCSM,NCS MULTISTAGE HLDGS INC COM NEW,
NCTY,THE9 LTD SPON ADS NEW,Belvedere Trading LLC
NCV,ALLIANZGI CONV & INCOME FD COM,
NCV-A,ALLIANZGI CONV & INCOME FD 5.625% CUM PFD A,
NCZ,ALLIANZGI CONV & INCOME FD II COM,
NCZ-A,ALLIANZGI CONV & INCOME FD II 5.50% CUM PFD A,
NDAQ,NASDAQ INC COM,"Susquehanna Securities, LLC"
NDLS,NOODLES & CO COM CL A,"Susquehanna Securities, LLC"
NDMO,NUVEEN DYNAMIC MUN OPPORTUNITI COM SHS,
NDP,TORTOISE ENERGY INDEPENDENC FD COM,
NDRA,ENDRA LIFE SCIENCES INC COM,
NDRAW,ENDRA LIFE SCIENCES INC WT EX,
NDSN,NORDSON CORP COM,"Susquehanna Securities, LLC"
NDX,NASDAQ 100 Index,
NEA,NUVEEN AMT FREE QLTY MUN INCME COM,
NEAR,ISHARES U S ETF TR BLACKROCK ST MAT,
NEBCU,NEBULA CARAVEL ACQUISITION COR UNIT EXP 120923,
NEBLQ,NOBLE CORP PLC SHS USD,"Susquehanna Securities, LLC"
NEE,NEXTERA ENERGY INC COM,"Wolverine Trading, LLC"
NEE-K,NEXTERA ENERGY CAP HLDGS INC JR SUB DEB 76,
NEE-N,NEXTERA ENERGY CAP HLDGS INC FXD NT79,
NEE-O,NEXTERA ENERGY INC 4.872 CORP UNITS,
NEE-P,NEXTERA ENERGY INC CORPORATE UNITS,
NEE-Q,NEXTERA ENERGY INC CORPORATE UNIT,
NEM,NEWMONT CORP COM,"Susquehanna Securities, LLC"
NEN,NEW ENGLAND RLTY ASSOC LTD PAR DEPOSITRY RCPT,
NEO,NEOGENOMICS INC COM NEW,"Group One Trading, L.P."
NEOG,NEOGEN CORP COM,"Group One Trading, L.P."
NEON,NEONODE INC COM PAR,
NEOS,NEOS THERAPEUTICS INC COM,"Group One Trading, L.P."
NEP,NEXTERA ENERGY PARTNERS LP COM UNIT PART IN,"Group One Trading, L.P."
NEPH,NEPHROS INC COM,
NEPT,NEPTUNE WELLNESS SOLUTIONS INC COM,Citadel Securities LLC
NERD,LISTED FD TR ROUNDHILL BITK,"Two Sigma Securities, LLC"
NERV,MINERVA NEUROSCIENCES INC COM,"Susquehanna Securities, LLC"
NES,NUVERRA ENVIRONMENTAL SOLUTION COM PAR,
NESR,NATIONAL ENERGY SERVICES REUNI SHS,
NESRW,NATIONAL ENERGY SERVICES REUNI WT EXP 050522,
NET,CLOUDFLARE INC CL A COM,Citadel Securities LLC
NETE,NET ELEMENT INC COM,
NETL,ETF SER SOLUTIONS NETLEASE CORP,
NEU,NEWMARKET CORP COM,
NEV,NUVEEN ENHANCED MUN VALUE FD COM,
NEW,PUXIN LTD ADS,"Group One Trading, L.P."
NEWA,NEWATER TECHNOLOGY INC SHS,
NEWR,NEW RELIC INC COM,"Susquehanna Securities, LLC"
NEWT,NEWTEK BUSINESS SVCS CORP COM NEW,"Wolverine Trading, LLC"
NEWTI,NEWTEK BUSINESS SVCS CORP 6.25% NT 23,
NEWTL,NEWTEK BUSINESS SVCS CORP NT LKD 24,
NEX,NEXTIER OILFIELD SOLUTIONS COM,Citadel Securities LLC
NEXA,NEXA RES S A COM,
NEXT,NEXTDECADE CORP COM,
NFBK,NORTHFIELD BANCORP INC DEL COM,"Wolverine Trading, LLC"
NFE,NEW FORTRESS ENERGY INC COM CL A,"Susquehanna Securities, LLC"
NFG,NATIONAL FUEL GAS CO N J COM,"Group One Trading, L.P."
NFH,NEW FRONTIER HEALTH CORP ORD SHS,
NFH+,NEW FRONTIER HEALTH CORP WT EXP 113024,
NFJ,ALLIANZGI DIVIDEND INT & PRMIU COM,
NFLT,ETFIS SER TR I VIRTUS NEWFLEET,
NFLX,NETFLIX INC COM,"Susquehanna Securities, LLC"
NFRA,FLEXSHARES TR STOXX GLOBR INF,
NFTY,FIRST TR EXCH TRD ALPHDX FD II INDIA NFTY50 EQW,
NG,NOVAGOLD RES INC COM NEW,"Susquehanna Securities, LLC"
NGA,NORTHERN GENESIS ACQUISITION C COMMON STOCK,
NGA+,NORTHERN GENESIS ACQUISITION C WT EXP 073127,
NGA=,NORTHERN GENESIS ACQUISITION C UNIT EX 073127,
NGAC,NEXTGEN ACQUISITION CORP CL A,
NGACU,NEXTGEN ACQUISITION CORP UNIT EXP 112620,
NGACW,NEXTGEN ACQUISITION CORP WT EXP 100625,
NGD,NEW GOLD INC CDA COM,GTS Securities LLC
NGE,GLOBAL X FDS GBL X MSCI NIGER,
NGG,NATIONAL GRID PLC SPONSORED ADR NE,"Susquehanna Securities, LLC"
NGHC,NATIONAL GEN HLDGS CORP COM,"Susquehanna Securities, LLC"
NGHCN,NATIONAL GEN HLDGS CORP DEP SHS PFD C,
NGHCO,NATIONAL GEN HLDGS CORP DEP SHS PFD-B,
NGHCP,NATIONAL GEN HLDGS CORP PFD SER A %,
NGHCZ,NATIONAL GEN HLDGS CORP SUB NT,
NGL,NGL ENERGY PARTNERS LP COM UNIT REPST,"Wolverine Trading, LLC"
NGL-B,NGL ENERGY PARTNERS LP PFD UNIT CL B,
NGL-C,NGL ENERGY PARTNERS LP 9.625 PFD UNIT C,
NGM,NGM BIOPHARMACEUTICALS INC COM,
NGMS,NEOGAMES S A SHS,
NGS,NATURAL GAS SERVICES GROUP COM,"Wolverine Trading, LLC"
NGVC,NATURAL GROCERS BY VITAMIN COT COM,"Susquehanna Securities, LLC"
NGVT,INGEVITY CORP COM,
NH,NANTHEALTH INC COM,"Susquehanna Securities, LLC"
NHA,NUVEEN MUN 2021 TARGET TERM FD COM,
NHC,NATIONAL HEALTHCARE CORP COM,"Susquehanna Securities, LLC"
NHF,NEXPOINT STRATEGIC OPPORTES FD COM NEW,
NHI,NATIONAL HEALTH INVS INC COM,
NHIC,NEWHOLD INVESTMENT CORP COM CL A,
NHICU,NEWHOLD INVESTMENT CORP UNIT EXP 031025,
NHICW,NEWHOLD INVESTMENT CORP WT EXP 031025,
NHLD,NATIONAL HLDGS CORP COM NEW,
NHLDW,NATIONAL HLDGS CORP WT EXP 011822,
NHS,NEUBERGER BERMAN HIGH YIELD ST COM,
NHTC,NATURAL HEALTH TRENDS CORP COM,Belvedere Trading LLC
NI,NISOURCE INC COM,"Group One Trading, L.P."
NI-B,NISOURCE INC 6% DEP SHS PFD B,
NIB,BARCLAYS BANK PLC ETN DJUBSCOCO 38,"Susquehanna Securities, LLC"
NICE,NICE LTD SPONSORED ADR,GTS Securities LLC
NICK,NICHOLAS FINL INC BC COM NEW,
NID,NUVEEN INTER DURATION MUN TERM COM,
NIE,ALLIANZGI EQUITY & CONV INCOME COM,
NIFE,DIREXION SHS ETF TR FALLEN KNIVES,
NIM,NUVEEN SELECT MAT MUN FD SH BEN INT,
NINE,NINE ENERGY SERVICE INC COM,
NIO,NIO INC SPON ADS,Citadel Securities LLC
NIQ,NUVEEN INT DUR QUAL MUN TRM FD COM,
NISN,NISUN INTL ENT DVPMT GP CO LTD COM CL A,
NIU,NIU TECHNOLOGIES ADS,"Group One Trading, L.P."
NJAN,INNOVATOR ETFS TR NASDAQ 100 PWR,
NJR,NEW JERSEY RES CORP COM,
NJUL,INNOVATOR ETFS TR NASDAQ 100 PWER,
NJV,NUVEEN NEW JERSEY MUN VALUE FD SHS,
NK,NANTKWEST INC COM,Morgan Stanley & Co. LLC
NKE,NIKE INC CL B,Citigroup Derivatives Markets Inc.
NKG,NUVEEN GEORGIA QLTY MUN INC FD COM,
NKLA,NIKOLA CORP COM,"Wolverine Trading, LLC"
NKSH,NATIONAL BANKSHARES INC VA COM,
NKTR,NEKTAR THERAPEUTICS COM,GTS Securities LLC
NKTX,NKARTA INC COM,
NKX,NUVEEN CALIFORNIA AMT QLT MUN COM,
NL,NL INDS INC COM NEW,
NLOK,NORTONLIFELOCK INC COM,"Susquehanna Securities, LLC"
NLR,VANECK VECTORS ETF TR URANIUM NUCLEAR,
NLS,NAUTILUS INC COM,"Wolverine Trading, LLC"
NLSN,NIELSEN HLDGS PLC SHS EUR,"Susquehanna Securities, LLC"
NLST,NETLIST INC COM,
NLTX,NEOLEUKIN THERAPEUTICS INC COM,"Group One Trading, L.P."
NLY,ANNALY CAPITAL MANAGEMENT INC COM,Citadel Securities LLC
NLY-D,ANNALY CAPITAL MANAGEMENT INC PFD SER D %,
NLY-F,ANNALY CAPITAL MANAGEMENT INC 6.95% PFD SER F,
NLY-G,ANNALY CAPITAL MANAGEMENT INC PFD SER G,
NLY-I,ANNALY CAPITAL MANAGEMENT INC 6.75% PFD SER I,
NM,NAVIOS MARITIME HOLDINGS INC COM,"Wolverine Trading, LLC"
NM-G,NAVIOS MARITIME HOLDINGS INC SPN ADS RP PFD G,
NM-H,NAVIOS MARITIME HOLDINGS INC SPON ADR PFD H,
NMCI,NAVIOS MARITIME CONTAINERS L P COM UNIT RP LP,
NMCO,NUVEEN MUN CR OPPORTUNITIES FD COM,
NMFC,NEW MTN FIN CORP COM,
NMFCL,NEW MTN FIN CORP 5.75% NT SR 23,
NMI,NUVEEN MUN INCOME FD INC COM,
NMIH,NMI HLDGS INC CL A,"Susquehanna Securities, LLC"
NMK-B,NIAGARA MOHAWK PWR CORP PFD 3.60%,
NMK-C,NIAGARA MOHAWK PWR CORP PFD 3.90%,
NML,NEUBERGER BERMAN MLP & ENERGY COM,
NMM,NAVIOS MARITIME PARTNERS L P COM UNIT LPI,"Group One Trading, L.P."
NMMC,NORTH MOUNTAIN MERGER CORP COM CL A,
NMMCU,NORTH MOUNTAIN MERGER CORP UNIT EXP 091625,
NMMCW,NORTH MOUNTAIN MERGER CORP WT EXP 091625,
NMR,NOMURA HLDGS INC SPONSORED ADR,"Wolverine Trading, LLC"
NMRD,NEMAURA MED INC COM NEW,
NMRK,NEWMARK GROUP INC CL A,"Susquehanna Securities, LLC"
NMS,NUVEEN MINN QUALITY MUN INM FD SHS,
NMT,NUVEEN MASSACHUSETS QLT MUN FD COM,
NMTR,9 METERS BIOPHARMA INC COM,
NMY,NUVEEN MARYLAND QLT MUN INC FD COM,
NMZ,NUVEEN MUN HIGH INCOME OPPORTU COM,
NNA,NAVIOS MARITIME ACQUIS CORP SHS,
NNBR,NN INC COM,Belvedere Trading LLC
NNDM,NANO DIMENSION LTD SPONSORD ADS NEW,Citadel Securities LLC
NNI,NELNET INC CL A,"Wolverine Trading, LLC"
NNN,NATIONAL RETAIL PROPERTIES INC COM,GTS Securities LLC
NNN-F,NATIONAL RETAIL PROPERTIES INC DEP SHS PFD F,
NNOX,NANO X IMAGING LTD ORD SHS,"Group One Trading, L.P."
NNVC,NANOVIRICIDES INC COM,"Group One Trading, L.P."
NNY,NUVEEN N Y MUN VALUE FD INC COM,
NOA,NORTH AMERN CONSTR GROUP LTD COM,"Wolverine Trading, LLC"
NOACU,NATURAL ORDER ACQUISITION CORP UNIT EX,
NOAH,NOAH HLDGS LTD SPON ADS CL A,"Susquehanna Securities, LLC"
NOBL,PROSHARES TR S&P 500 DV ARIST,"Susquehanna Securities, LLC"
NOC,NORTHROP GRUMMAN CORP COM,Citadel Securities LLC
NOCT,INNOVATOR ETFS TR NASDAQ 100 PWR,
NODK,NI HLDGS INC COM,
NOG,NORTHERN OIL AND GAS INC MN COM,"Group One Trading, L.P."
NOK,NOKIA CORP SPONSORED ADR,"Susquehanna Securities, LLC"
NOM,NUVEEN MISSOURI QLT MUN INC FD COM,
NOMD,NOMAD FOODS LTD USD ORD SHS,"Susquehanna Securities, LLC"
NORW,GLOBAL X FDS GLBX MSCI NORW,
NOV,NATIONAL OILWELL VARCO INC COM,Citadel Securities LLC
NOVA,SUNNOVA ENERGY INTL INC. COM,"Susquehanna Securities, LLC"
NOVN,NOVAN INC COM,
NOVS,NOVUS CAP CORP COM,
NOVSU,NOVUS CAP CORP UNIT EXP 063027,
NOVSW,NOVUS CAP CORP WT EXP 063027,
NOVT,NOVANTA INC COM,Citadel Securities LLC
NOW,SERVICENOW INC COM,"Susquehanna Securities, LLC"
NP,NEENAH INC COM,
NPA,NEW PROVIDENCE ACQUISITION COM CL A,
NPAUU,NEW PROVIDENCE ACQUISITION UNIT EX 090124,
NPAWW,NEW PROVIDENCE ACQUISITION WT EXP 091126,
NPK,NATIONAL PRESTO INDS INC COM,
NPN,NUVEEN PA MUN VALUE FD COM,
NPO,ENPRO INDS INC COM,Morgan Stanley & Co. LLC
NPTN,NEOPHOTONICS CORP COM,"Group One Trading, L.P."
NPV,NUVEEN VIRGINIA QLTY MUNCPL FD COM,
NQP,NUVEEN PENNSYLVANIA QLT MUN FD COM,
NR,NEWPARK RES INC COM PAR $.01NEW,Belvedere Trading LLC
NRBO,NEUROBO PHARMACEUTICALS INC COM,
NRC,NATIONAL RESH CORP COM NEW,
NREF,NEXPOINT REAL ESTATE FIN INC COM,
NREF-A,NEXPOINT REAL ESTATE FIN INC 8.50% RED PFD A,
NRG,NRG ENERGY INC COM NEW,GTS Securities LLC
NRGD,BANK OF MONTREAL BIG OIL INDX 3X,
NRGU,BANK OF MONTREAL BIG OIL 3X LEV,
NRGX,PIMCO ENRGY TACTICAL CR OPP FD COM SHS BEN INT,
NRIM,NORTHRIM BANCORP INC COM,
NRIX,NURIX THERAPEUTICS INC COM,
NRK,NUVEEN NEW YORK AMT QLT MUNICP COM,
NRO,NEUBERGER BERMAN REAL ESTATE S COM,
NRP,NATURAL RESOURCE PARTNERS L P COM UNIT LTD PAR,Citadel Securities LLC
NRT,NORTH EUROPEAN OIL RTY TR SH BEN INT,
NRTSF,NOBILIS HEALTH CORP COM,
NRUC,NATIONAL RURAL UTILS COOP FIN 5.5% SUB NT 64,
NRZ,NEW RESIDENTIAL INVT CORP COM NEW,Morgan Stanley & Co. LLC
NRZ-A,NEW RESIDENTIAL INVT CORP 7.50% PFD SER A,
NRZ-B,NEW RESIDENTIAL INVT CORP 7.125 SR B PFD,
NRZ-C,NEW RESIDENTIAL INVT CORP 6.375 PFD SER C,
NS,NUSTAR ENERGY LP UNIT COM,"Wolverine Trading, LLC"
NS-A,NUSTAR ENERGY LP PFD UNIT SER A,
NS-B,NUSTAR ENERGY LP RED PFD SER B,
NS-C,NUSTAR ENERGY LP 9.00% CUM PFD C,
NSA,NATIONAL STORAGE AFFILIATES TR COM SHS BEN IN,Citadel Securities LLC
NSA-A,NATIONAL STORAGE AFFILIATES TR 6% PFD BEN INT A,
NSC,NORFOLK SOUTHN CORP COM,Citigroup Derivatives Markets Inc.
NSCO,NESCO HLDGS INC COM,
NSCO+,NESCO HLDGS INC WT EXP 010125,
NSEC,NATIONAL SEC GROUP INC COM,
NSH,NAVSIGHT HLDGS INC CL A,
NSH+,NAVSIGHT HLDGS INC WT EXP 010130,
NSH=,NAVSIGHT HLDGS INC UNITS,
NSIT,INSIGHT ENTERPRISES INC COM,"Susquehanna Securities, LLC"
NSL,NUVEEN SR INCOME FD COM,
NSP,INSPERITY INC COM,GTS Securities LLC
NSPR,INSPIREMD INC COM,
NSPR+,INSPIREMD INC WT EXP 070721,
NSPR+B,INSPIREMD INC WT B EXP 031422,
NSS,NUSTAR LOGISTICS L P SB NT FX/FL 43,
NSSC,NAPCO SEC TECHNOLOGIES INC COM,"Group One Trading, L.P."
NSTG,NANOSTRING TECHNOLOGIES INC COM,"Susquehanna Securities, LLC"
NSYS,NORTECH SYS INC COM,
NTAP,NETAPP INC COM,GTS Securities LLC
NTB,BANK OF NT BUTTERFIELD&SON LTD SHS NEW,
NTCO,NATURA &CO HLDG S A ADS,
NTCT,NETSCOUT SYS INC COM,GTS Securities LLC
NTEC,INTEC PHARMA LTD JERUSALEM SHS NEW,"Susquehanna Securities, LLC"
NTES,NETEASE INC SPONSORED ADS,"Susquehanna Securities, LLC"
NTG,TORTOISE MIDSTRM ENERGY FD INC COM,
NTGR,NETGEAR INC COM,Citadel Securities LLC
NTIC,NORTHERN TECHNOLOGIES INTL COR COM,
NTIP,NETWORK-1 TECHNOLOGIES INC COM,
NTLA,INTELLIA THERAPEUTICS INC COM,"Susquehanna Securities, LLC"
NTN,NTN BUZZTIME INC COM PAR,
NTNX,NUTANIX INC CL A,"Susquehanna Securities, LLC"
NTP,NAM TAI PPTY INC SHS,"Susquehanna Securities, LLC"
NTR,NUTRIEN LTD COM,Citadel Securities LLC
NTRA,NATERA INC COM,"Wolverine Trading, LLC"
NTRS,NORTHERN TR CORP COM,GTS Securities LLC
NTRSO,NORTHERN TR CORP 4.7% DP SH PF E,
NTST,NETSTREIT CORP COM,
NTSX,WISDOMTREE TR 90/60 BALNCED FD,
NTUS,NATUS MED INC DEL COM,
NTWK,NETSOL TECHNOLOGIES INC COM PAR $.001,"Wolverine Trading, LLC"
NTZ,NATUZZI S P A SPON ADS,
NUAG,NUSHARES ETF TR NUVEEN ENHNC YLD,
NUAN,NUANCE COMMUNICATIONS INC COM,GTS Securities LLC
NUBD,NUSHARES ETF TR NUVEEN ESG US,
NUDM,NUSHARES ETF TR NUVEEN ESG INTL,
NUE,NUCOR CORP COM,"Susquehanna Securities, LLC"
NUEM,NUSHARES ETF TR NUVEEN ESG EMRGN,
NUGT,DIREXION SHS ETF TR DLY GOLD INDX 2X,Citadel Securities LLC
NUHY,NUSHARES ETF TR ESG HI TLD CRP,
NULC,NUSHARES ETF TR ESG LARGE CAP,
NULG,NUSHARES ETF TR NUVEEN ESG LRGCP,
NULV,NUSHARES ETF TR NUVEEN ESG LRGVL,
NUM,NUVEEN MICH QUALITY MUN INCOME COM,
NUMG,NUSHARES ETF TR NUVEEN ESG MIDCP,
NUMV,NUSHARES ETF TR NUVEEN ESG MIDVL,
NUO,NUVEEN OHIO QLTY MUN INCOME FD COM,
NURE,NUSHARES ETF TR NUVEEN SHRT TERM,
NURO,NEUROMETRIX INC COM,
NUS,NU SKIN ENTERPRISES INC CL A,"Wolverine Trading, LLC"
NUSA,NUSHARES ETF TR NUVEEN ENHCD 1 5,
NUSC,NUSHARES ETF TR NUVEEN ESG SMLCP,
NUSI,ETF SER SOLUTIONS NATIONWIDE RSK,
NUV,NUVEEN MUN VALUE FD INC COM,
NUVA,NUVASIVE INC COM,"Susquehanna Securities, LLC"
NUW,NUVEEN AMT-FREE MUN VALUE FD COM,
NUZE,NUZEE INC COM NEW,
NVAX,NOVAVAX INC COM NEW,Citadel Securities LLC
NVCN,NEOVASC INC COM,
NVCR,NOVOCURE LTD ORD SHS,"Susquehanna Securities, LLC"
NVDA,NVIDIA CORPORATION COM,GTS Securities LLC
NVEC,NVE CORP COM NEW,
NVEE,NV5 GLOBAL INC COM,Citadel Securities LLC
NVFY,NOVA LIFESTYLE INC COM NEW,
NVG,NUVEEN AMT FREE MUN CR INC FD COM,
NVGS,NAVIGATOR HLDGS LTD SHS,Morgan Stanley & Co. LLC
NVIV,INVIVO THERAPEUTICS HLDGS CORP COM,
NVMI,NOVA MEASURING INSTRUMENTS LTD COM,"Wolverine Trading, LLC"
NVMZ,LISTED FD TR TRUESHARES NOV,
NVO,NOVO-NORDISK A S ADR,Morgan Stanley & Co. LLC
NVQ,EXCHANGE LISTED FDS TR QRAFT AI ENANE,
NVR,NVR INC COM,
NVRO,NEVRO CORP COM,Citadel Securities LLC
NVS,NOVARTIS AG SPONSORED ADR,"Susquehanna Securities, LLC"
NVST,ENVISTA HOLDINGS CORPORATION COM,Citadel Securities LLC
NVT,NVENT ELECTRIC PLC SHS,"Susquehanna Securities, LLC"
NVTA,INVITAE CORP COM,"Susquehanna Securities, LLC"
NVTRQ,NUVECTRA CORP COM,
NVUS,NOVUS THERAPEUTICS INC COM,
NWBI,NORTHWEST BANCSHARES INC MD COM,
NWE,NORTHWESTERN CORP COM NEW,"Susquehanna Securities, LLC"
NWFL,NORWOOD FINL CORP COM,
NWG,NATWEST GROUP PLC SPONS ADR 2 ORD,"Wolverine Trading, LLC"
NWHM,NEW HOME CO INC COM,
NWL,NEWELL BRANDS INC COM,"Susquehanna Securities, LLC"
NWLI,NATIONAL WESTN LIFE GROUP INC CL A,
NWN,NORTHWEST NAT HLDG CO COM,
NWPX,NORTHWEST PIPE CO COM,"Wolverine Trading, LLC"
NWS,NEWS CORP NEW CL B,
NWSA,NEWS CORP NEW CL A,"Susquehanna Securities, LLC"
NX,QUANEX BUILDING PRODUCTS CORP COM,"Susquehanna Securities, LLC"
NXC,NUVEEN CALIF SELECT TAX FREE I SH BEN INT,
NXE,NEXGEN ENERGY LTD COM,
NXGN,NEXTGEN HEALTHCARE INC COM,Citadel Securities LLC
NXJ,NUVEEN NEW JERSEY QULT MUN FD COM,
NXN,NUVEEN N Y SELECT TAX FREE INC SH BEN INT,
NXP,NUVEEN SELECT TAX-FREE INCOME SH BEN INT,
NXPI,NXP SEMICONDUCTORS N V COM,"Susquehanna Securities, LLC"
NXQ,NUVEEN SELECT TAX FREE INCOME SH BEN INT,
NXR,NUVEEN SELECT TAX FREE INCOME SH BEN INT,
NXRT,NEXPOINT RESIDENTIAL TR INC COM,Belvedere Trading LLC
NXST,NEXSTAR MEDIA GROUP INC CL A,"Susquehanna Securities, LLC"
NXTC,NEXTCURE INC COM,
NXTD,NXT-ID INC COM NEW,"Group One Trading, L.P."
NXTG,FIRST TR EXCHANGE TRADED FD II INDXX NEXTG ETF,
NYC,NEW YORK CITY REIT INC COM,
NYCB,NEW YORK CMNTY BANCORP INC COM,"Susquehanna Securities, LLC"
NYCB-A,NEW YORK CMNTY BANCORP INC DEP SHS REPSTG A,
NYCB-U,NEW YORK CMNTY CAP TR V BONUSES UNIT,
NYF,ISHARES TR NEW YORK MUN ETF,
NYMT,NEW YORK MTG TR INC COM PAR $.02,"Wolverine Trading, LLC"
NYMTM,NEW YORK MTG TR INC 7.875% SER E PFD,
NYMTN,NEW YORK MTG TR INC 8% RED PFD D,
NYMTO,NEW YORK MTG TR INC PFD-C CONV,
NYMTP,NEW YORK MTG TR INC RED PFD B 7.75%,
NYMX,NYMOX PHARMACEUTICAL CORP COM,"Group One Trading, L.P."
NYT,NEW YORK TIMES CO CL A,Citadel Securities LLC
NYV,NUVEEN NEW YORK MUN VALUE FD 2 COM,
NZF,NUVEEN MUNICIPAL CREDIT INC FD COM SH BEN INT,
O,REALTY INCOME CORP COM,"Wolverine Trading, LLC"
OAC,OAKTREE ACQUISITION CORP SHS CL A,
OAC+,OAKTREE ACQUISITION CORP WT EXP,
OAC=,OAKTREE ACQUISITION CORP UNITS EX,
OACB,OAKTREE ACQUISITION CORP II CL A SHS,
OACB+,OAKTREE ACQUISITION CORP II WT EXP 091527,
OACB=,OAKTREE ACQUISITION CORP II UNIT EX 091527,
OAK-A,OAKTREE CAP GROUP LLC 6.625% PFD UT A,
OAK-B,OAKTREE CAP GROUP LLC 6.550 PFD UNT B,
OAS,OASIS PETROLEUM INC COM NEW,Belvedere Trading LLC
OASMY,OASMIA PHARMACEUTICAL AB ADR,
OASPQ,OASIS PETROLEUM INC COM,Citadel Securities LLC
OASQW,"Oasis Petroleum, Inc",
OBAS,OPTIBASE LTD SHS NEW NIS0.13,
OBCI,OCEAN BIO CHEM INC COM,
OBELF,OBSIDIAN ENERGY LTD COM,"Susquehanna Securities, LLC"
OBLG,OBLONG INC COM,
OBLN,OBALON THERAPEUTICS INC COM NEW,
OBNK,ORIGIN BANCORP INC COM,
OBOR,KRANESHARES TR MSCI ONE BELT,
OBSV,OBSEVA SA COM,
OC,OWENS CORNING NEW COM,Citigroup Derivatives Markets Inc.
OCA=,OMNICHANNEL ACQUISITION CORP UNIT EX,
OCC,OPTICAL CABLE CORP COM NEW,
OCCI,OFS CREDIT COMPANY INC COM,
OCCIP,OFS CREDIT COMPANY INC 6.875% PFD A,
OCFC,OCEANFIRST FINL CORP COM,"Group One Trading, L.P."
OCFCP,OCEANFIRST FINL CORP 7% DP SHS PFD A,
OCFT,ONECONNECT FINL TECHNOLOGY CO SPONSORED ADS,
OCG,ORIENTAL CULTURE HOLDING LTD ORD SHS,
OCGN,OCUGEN INC COM,
OCIO,ETF SER SOLUTIONS CLEARSHS OCIO,
OCN,OCWEN FINL CORP COM NEW,"Group One Trading, L.P."
OCSI,OAKTREE STRATEGIC INCOME CORP COM,
OCSL,OAKTREE SPECIALTY LENDING CORP COM,Citadel Securities LLC
OCTZ,LISTED FD TR TRUESHARES OCT,
OCUL,OCULAR THERAPEUTIX INC COM,Citadel Securities LLC
OCUP,OCUPHIRE PHARMA INC COM,
OCX,ONCOCYTE CORP COM,"Group One Trading, L.P."
ODC,OIL DRI CORP AMER COM,
ODFL,OLD DOMINION FREIGHT LINE INC COM,"Susquehanna Securities, LLC"
ODP,THE ODP CORP COM,"Two Sigma Securities, LLC"
ODT,ODONATE THERAPEUTICS INC COM,"Susquehanna Securities, LLC"
OEC,ORION ENGINEERED CARBONS S A COM,
OEF,ISHARES TR S&P 100 ETF,Citigroup Derivatives Markets Inc.
OEG,ORBITAL ENERGY GROUP INC COM,"Wolverine Trading, LLC"
OESX,ORION ENERGY SYSTEMS INC COM,"Susquehanna Securities, LLC"
OEUR,OSI ETF TR OSHARES EUR QLT,
OEX,S&P 100 index American-style,Citigroup Derivatives Markets Inc.
OFC,CORPORATE OFFICE PPTYS TR SH BEN INT,"Susquehanna Securities, LLC"
OFED,OCONEE FED FINL CORP COM,
OFG,OFG BANCORP COM,"Wolverine Trading, LLC"
OFG-A,OFG BANCORP PFD A 7.125%,
OFG-B,OFG BANCORP 7% SER B PFD,
OFG-D,OFG BANCORP PERP PFD-D,
OFIX,ORTHOFIX MED INC COM,"Susquehanna Securities, LLC"
OFLX,OMEGA FLEX INC COM,
OFS,OFS CAP CORP COM,
OFSSG,OFS CAP CORP 6.25% CAL NT 23,
OFSSI,OFS CAP CORP 5.95% NT 2026,
OFSSL,OFS CAP CORP 6.375% NT 25,
OFSSZ,OFS CAP CORP 6.50% NT 25,
OGCP,EMPIRE ST RLTY OP L P UNIT LTD PRT 60,
OGE,OGE ENERGY CORP COM,"Wolverine Trading, LLC"
OGEN,ORAGENICS INC COM PAR,
OGI,ORGANIGRAM HLDGS INC COM,
OGIG,OSI ETF TR OSHS GBL INTER,Belvedere Trading LLC
OGS,ONE GAS INC COM,"Wolverine Trading, LLC"
OHI,OMEGA HEALTHCARE INVS INC COM,"Susquehanna Securities, LLC"
OI,O-I GLASS INC COM,Citadel Securities LLC
OIA,INVESCO MUNI INCOME OPP TRST COM,
OIBR.C,OI SA SPONSORED ADR NE,
OIH,VANECK VECTORS ETF TR OIL SVCS ETF,GTS Securities LLC
OII,OCEANEERING INTL INC COM,Citadel Securities LLC
OIIM,O2MICRO INTERNATIONAL LIMITED SPONS ADR,
OIL,BARCLAYS BANK PLC IPTH CRUDE OIL,
OILK,PROSHARES TR K1 FRE CRD OIL,
OILNF,BARCLAYS BK PLC IPSP CROIL ETN,
OIS,OIL STS INTL INC COM,"Susquehanna Securities, LLC"
OKE,ONEOK INC NEW COM,"Susquehanna Securities, LLC"
OKTA,OKTA INC CL A,"Susquehanna Securities, LLC"
OLB,OLB GROUP INC COM,
OLD,JANUS DETROIT STR TR LONG TERM CARE,
OLED,UNIVERSAL DISPLAY CORP COM,GTS Securities LLC
OLLI,OLLIES BARGAIN OUTLET HLDGS IN COM,Citadel Securities LLC
OLMA,OLEMA PHARMACEUTICALS INC COM,
OLN,OLIN CORP COM PAR $1,"Two Sigma Securities, LLC"
OLOXF,DEUTSCHE BK AG LONDON BRH DB CRUDE OIL LNG,
OLP,ONE LIBERTY PPTYS INC COM,
OM,OUTSET MED INC COM,
OMAB,GRUPO AEROPORTUARIO DEL CENTRO SPON ADR,
OMC,OMNICOM GROUP INC COM,"Susquehanna Securities, LLC"
OMCL,OMNICELL COM COM,"Susquehanna Securities, LLC"
OMER,OMEROS CORP COM,Citadel Securities LLC
OMEX,ODYSSEY MARINE EXPL INC COM NEW,Morgan Stanley & Co. LLC
OMF,ONEMAIN HLDGS INC COM,Citadel Securities LLC
OMFL,INVESCO EXCH TRD SLF IDX FD TR RUSL 1000 DYNM,
OMFS,INVESCO EXCH TRD SLF IDX FD TR RUSL 2000 DYNM,
OMI,OWENS & MINOR INC NEW COM,Citadel Securities LLC
OMP,OASIS MIDSTREAM PARTNERS LP COM UNITS REPS,
ON,ON SEMICONDUCTOR CORP COM,"Wolverine Trading, LLC"
ONB,OLD NATL BANCORP IND COM,GTS Securities LLC
ONCR,ONCORUS INC COM,
ONCS,ONCOSEC MED INC COM,
ONCT,ONCTERNAL THERAPEUTICS INC COM,
ONCY,ONCOLYTICS BIOTECH INC COM NEW,
ONDS,ONDAS HLDGS INC COM NEW,
ONE,ONESMART INTL ED GROUP LTD SPONSORED ADS,
ONEM,1LIFE HEALTHCARE INC COM,"Susquehanna Securities, LLC"
ONEO,SPDR SER TR RUSSELL MOMENTUM,
